question,answer
"Which unlikely creature did Hollywood actor Goldie Hawn claim ""touched my face""?",A giraffe
Newly released figures show that the amount of electricity produced by which type of renewable energy hit a record high in Britain last year?,Wind power
A judge ruled that the use of which emoji constituted a “binding signature” in a contractual dispute?,"The judge ruled that the use of the ""👍"" emoji constituted a ""binding signature"" in the contractual dispute."
The cast of which television show visited the White House this week to help promote mental health awareness?,"The cast of the television show ""This Is Us"" visited the White House this week to help promote mental health awareness."
Man City’s 2-1 victory over Man Utd last weekend brought the Sky Blue’s total tally of FA Cup title wins to how many?,6
"Which retail chain recalled nearly 50,000 mattresses due to the risk of mold exposure?","The retail chain that recalled nearly 50,000 mattresses due to the risk of mold exposure was IKEA."
Why did an angry shopper complain to Sainsbury’s over its rump steak this week?,"The angry shopper complained to Sainsbury's over its rump steak this week because the steak was labeled as being from the UK, but upon closer inspection, the shopper discovered that the meat was actually from Poland. This mislabeling of the product led to the shopper feeling deceived and upset."
Which American football team was left out of the 2023 College Football Playoffs despite being undefeated this season?,The Cincinnati Bearcats were left out of the 2023 College Football Playoffs despite being undefeated this season.
NBA superstar Kevin Durant is headed to which team after the Brooklyn Nets traded the former MVP?,Kevin Durant is headed to the Golden State Warriors after the Brooklyn Nets traded the former MVP.
Fox News agreed to pay electronic voting company Dominion how much to settle a defamation lawsuit?,$1.6 billion
Which airline will begin weighing some passengers before flights?,Samoa Air
The FDA this week approved a new vaccine for which common virus?,The FDA this week approved a new vaccine for the common virus known as influenza (the flu).
A priest was accused of desecration after he set up what in a 600-year-old church in Cornwall?,A priest was accused of desecration after he set up a crazy golf course in a 600-year-old church in Cornwall.
Who has returned to TV screens in the role of Sergeant Catherine Cawood in hit BBC series Happy Valley?,Sarah Lancashire
Connecticut won the NCAA men’s basketball national title Monday after defeating San Diego State. How many championships does the program have?,Connecticut has a total of four NCAA men's basketball national championships.
Memorial Day weekend is a great time to hit the beach. Which state is known as The Ocean State?,Rhode Island
Which labor union ended a historic strike this week?,The United Auto Workers (UAW) labor union ended a historic strike this week.
"Rose Zhang won the Mizuho Americas Open on Sunday, becoming the first golfer to win on the LPGA tour in her debut since:",Beverly Hanson in 1951.
"In 1803, the US purchased the Louisiana Territory from which country?",France
Where will the annual Punkin Chunkin World Championship be held this year?,"The annual Punkin Chunkin World Championship will be held in Bridgeville, Delaware this year."
Which chocolate bar now has paper wrappers to make it more environmentally friendly?,Cadbury Dairy Milk
What is the name of a fugitive Pennsylvania pig caught after 18 days on the run?,Norman the pig
Which MLB team won the World Series this week?,The Atlanta Braves won the World Series this week.
Rishi Sunak has faced scrutiny as a subject of how many investigations or probes in the past year?,Rishi Sunak has faced scrutiny as a subject of two investigations or probes in the past year.
Which Thanksgiving dish was invented in the 1950s by a Campbell Soup Company employee named Dorcas Reilly with the hope of boosting sales of one of Campbell’s products?,Green bean casserole
Which England football player scored twice in Tuesday’s 6-1 win against China at the Women’s World Cup?,Ellen White scored twice in Tuesday's 6-1 win against China at the Women's World Cup.
Which football team won the Carabao Cup final on Sunday?,Manchester City won the Carabao Cup final on Sunday.
Which of the following statements about traveling to Puerto Rico from Wilmington Airport is FALSE?,The statement that there are direct flights from Wilmington Airport to Puerto Rico is FALSE.
Actress Gwyneth Paltrow appeared in court this week over her alleged involvement in which type of accident?, Actress Gwyneth Paltrow appeared in court this week over her alleged involvement in a skiing accident.
Thousands of US flights were disrupted this week by which type of weather event?,Snowstorms
Dominion Voting Systems settled with which TV network in a defamation lawsuit over the broadcast of lies after the 2020 presidential election?,Dominion Voting Systems settled with Fox News in a defamation lawsuit over the broadcast of lies after the 2020 presidential election.
Democratic Sen. Laphonza Butler made history this week when she became the only Black woman presently serving in the Senate. Which state does she represent?,California
Which professional dancer is set to replace Tyra Banks as one of the hosts of ABC’s “Dancing With the Stars”?,Derek Hough
"Short daily naps may help keep the brain healthy by doing what, according to a newly published University College London study?","According to a newly published University College London study, short daily naps may help keep the brain healthy by clearing out waste products that can lead to neurodegenerative diseases like Alzheimer's."
"Scientists recently revived a “zombie” virus that they say spent nearly 50,000 years:","The virus that scientists recently revived after nearly 50,000 years is the Pithovirus sibericum, which was discovered in the Siberian permafrost."
Which musician will headline the Super Bowl LVIII halftime show?,"As of now, the musician set to headline the Super Bowl LVIII halftime show has not been officially announced."
"Following her ouster from Congress last year, former Wyoming GOP Rep. Liz Cheney accepted job teaching at which university?",University of Virginia
Locals in the Spanish village San Bartolome de Pinares honour Saint Anthony every 16 January by doing what?,"Locals in the Spanish village San Bartolome de Pinares honour Saint Anthony every 16 January by participating in the traditional ""Luminarias"" festival, where they ride horses through bonfires to purify and protect the animals for the coming year."
A 14-year-old won the title of America's Top Young Scientist for developing a soap that treats what?,The 14-year-old won the title of America's Top Young Scientist for developing a soap that treats contaminated water.
Taylor Swift attended which NFL match amid rumours of a new romance?,Taylor Swift attended the New York Giants vs. New England Patriots NFL match amid rumours of a new romance.
Which podcast became the first ever to be awarded the British Academy President's Medal for services to the humanities?,"The podcast ""In Our Time"" hosted by Melvyn Bragg became the first ever to be awarded the British Academy President's Medal for services to the humanities."
Who won Best Director at the 2023 Golden Globes?,"Sorry, I am unable to provide real-time information as my responses are based on a mixture of licensed data, data created by human trainers, and publicly available data."
Which type of recalled food was mistakenly distributed to several large retailers?,Tainted ground beef
US Rep. George Santos was expelled from the House of Representatives after a scathing report from the Ethics Committee. Which state is Santos from?,George Santos is from the state of New York.
Which NFL team made a visit to the White House this week to celebrate their Super Bowl victory?,The Tampa Bay Buccaneers made a visit to the White House this week to celebrate their Super Bowl victory.
West Virginia announced an $87 million settlement with which company for its role in perpetuating the opioid crisis in the state?,McKesson Corporation
Which fruit crop in Georgia has been severely impacted by extreme winter weather?,Peaches
Which Hollywood star was seen working at a Dunkin’ Donuts this week?,Ben Affleck was seen working at a Dunkin' Donuts this week.
Which three-digit phone number is going out of service for millions of Americans?,The three-digit phone number going out of service for millions of Americans is 411.
"The Federal Trade Commission announced this week it is suing which company, alleging it tricked millions of consumers into signing up for its paid subscription service?","The Federal Trade Commission announced this week it is suing the company known as ""Match Group,"" alleging it tricked millions of consumers into signing up for its paid subscription service."
The CDC this week announced it will no longer distribute which item?,The CDC this week announced it will no longer distribute the Johnson & Johnson COVID-19 vaccine.
Which European royal was accused of infidelity with her former brother-in-law?,Princess Diana
"Ford is recalling about 176,000 vehicles over difficult-to-reach seatbelts. Which model is being recalled?",The Ford model being recalled for difficult-to-reach seatbelts is the 2021 Ford F-150.
Which drink company is receiving criticism for allegedly marketing high-caffeine products to children?,Monster Energy Drink
What was the original purpose of the Baal statue that stood near the Smyrna Rest Area in Delaware?,The original purpose of the Baal statue near the Smyrna Rest Area in Delaware was to serve as a promotional tool for a local antique store.
Which music superstar announced she will soon embark on a global tour?,Beyoncé announced she will soon embark on a global tour.
A NASA telescope recently spotted a phenomenon in deep space that looked like which symbol?,A NASA telescope recently spotted a phenomenon in deep space that looked like the Batman symbol.
"Around 5,000 people took part in a record-breaking “Grande Dictée” (Great Dictation) event at which landmark Paris location?",The Eiffel Tower.
One lucky lottery ticket for the $1.73 billion Powerball jackpot was sold this week in which state?,The lucky lottery ticket for the $1.73 billion Powerball jackpot was sold in South Carolina.
How many stars were on the first US flag?,There were 13 stars on the first US flag.
"What is the name of the hurricane that slammed into Acapulco, Mexico, this week?",Hurricane Pamela
Which type of product received a sweeping recall this week over concerns of fire and burn hazards?, Lithium-ion batteries
Phone networks and internet connections were down for millions Wednesday in which country?,Sri Lanka
A cell-based meat company resurrected the extinct woolly mammoth in the form of:,A cell-based meat company resurrected the extinct woolly mammoth in the form of a burger.
An episode of which cartoon that referenced Chinese labour camps was pulled from Disney’s Hong Kong streaming service?,The Simpsons
Scientists believe they have found the answer to high levels of radioactivity in which wild European animal?,Chernobyl's radioactive boars
What is the name of the dog mentioned in the article who spent 942 days at a shelter before being permanently adopted?,Marmaduke
"True or false: With this week’s win in the NBA Finals, the Denver Nuggets claimed their first NBA championship.",False. The Denver Nuggets have never won an NBA championship.
A new study names which country as the worst in the developed world for housing?,United States
"Which Delaware State University alumnus, now playing for the Colorado Buffaloes, could see extra playing time in the upcoming game against USC due to his strong performance despite limited playing time in the previous game against Oregon?",Laviska Shenault Jr.
Who is the only American finalist for the Varkey Foundation Global Teacher Prize 2023?,The only American finalist for the Varkey Foundation Global Teacher Prize 2023 is Dr. Jared Fox.
What was the headline in The News Journal that referred to the wild fir tree growing from a crack in Philadelphia Pike?,"""Nature's Resilience: Fir Tree Thrives in Unlikely Urban Setting on Philadelphia Pike"""
"Which US state is represented by congressman Kevin McCarthy, the Republican leader whose bid to be voted House speaker was blocked by GOP hardliners this week?",California
"This week, former Los Angeles Mayor Eric Garcetti was finally confirmed as ambassador to which country after a 20-month fight?",India
Which state is investigating robotaxi collisions after a handful of incidents recently endangered pedestrians?,California
Humza Yousaf won the second round of the SNP leadership election with what percentage of the vote?,Humza Yousaf won the second round of the SNP leadership election with 53.5% of the vote.
Mike Pence declined to appeal a subpoena from a Justice Department special counsel investigating Donald Trump for:,obstruction of justice
What was Krispy Kreme offering to customers with losing lottery tickets?,Krispy Kreme was offering a free doughnut to customers who brought in losing lottery tickets.
"A French woman named Lucile Randon, believed to be the world’s oldest person, died this week. What age was she?","Lucile Randon, also known as Sister Andre, was 117 years old when she passed away."
"Bill Irvin, owner of The Brandywine Restaurant, was inspired by classic elegance and a dining experience from the '50s and '60s. What is the special place he aimed to create with this restaurant?",Bill Irvin aimed to create a special place that captured the classic elegance and dining experience of the '50s and '60s at The Brandywine Restaurant.
What is the main focus of Bryan Stevenson's work as the founder and executive director of the Equal Justice Initiative?,"The main focus of Bryan Stevenson's work as the founder and executive director of the Equal Justice Initiative is to fight for racial and economic justice, and to challenge bias and discrimination in the criminal justice system. He is dedicated to providing legal representation to individuals who have been unfairly treated or wrongly convicted, particularly those on death row. Stevenson also works to raise awareness about issues such as mass incarceration and the death penalty."
"This week, mortgage rates in the US rose for the fourth consecutive week as inflation concerns remain. What is the current average rate for a 30-year fixed mortgage?",The current average rate for a 30-year fixed mortgage in the US is around 3.15%.
Which pop star sent the internet into a frenzy after making a surprise appearance at a Kansas City Chiefs football game?,Britney Spears sent the internet into a frenzy after making a surprise appearance at a Kansas City Chiefs football game.
The former prime minister of which Southeast Asian country was arrested after returning from 15 years in exile?,Thailand
"What is the minimum annual income required for a family of four to be considered middle class in Delaware in 2023, according to the study?","The minimum annual income required for a family of four to be considered middle class in Delaware in 2023 is $78,676, according to the study."
A record $3.8 billion worth of cryptocurrency was stolen from various services last year. Some of the biggest thefts were driven by hackers linked to which country?,North Korea
Which fast food chain is closing its first-ever restaurant after more than a half-century in business?,A&W Restaurants
"Hundreds of people were arrested in which country after government buildings in its capital city were attacked, vandalized and looted on Jan. 8?",Uganda
"What percentage of Brits suffer from a psychological condition known as misophonia, according to a new study?","According to a new study, approximately 20% of Brits suffer from misophonia, a psychological condition characterized by a strong emotional response to certain sounds."
The US opened an embassy this week in which Pacific island nation?,Palau
"According to the study conducted by Med.ro, which state has the second longest average emergency room waiting time in the United States?",Maryland
The Sacramento Kings officially ended the longest playoff drought of any U.S. major pro sports team. When did they last make the postseason?,The Sacramento Kings last made the postseason in the 2005-2006 NBA season.
"What is the projected number of Americans expected to travel 50 miles or more between Christmas and New Year’s this year, according to AAA’s holiday forecast?","The projected number of Americans expected to travel 50 miles or more between Christmas and New Year’s this year, according to AAA’s holiday forecast, is around 115.6 million."
"After six decades in the making, the FDA this week approved the first vaccine for which virus?",COVID-19
Thousands of people were evacuated from the Icelandic town of Grindavik amid fears of an eruption by which volcano?,Mount Keilir
Which nation is experiencing a wave of protests after its leader pushed forward an unpopular bill to raise the country's retirement age?,France
The maximum value of the Pell Grant awarded to college students will be raised by how much in the 2023 fiscal year?,The maximum value of the Pell Grant awarded to college students will be raised by $400 in the 2023 fiscal year.
Which pop duo are embroiled in a legal battle after one obtained a restraining order against the other?,The pop duo embroiled in a legal battle after one obtained a restraining order against the other is Tegan and Sara.
Proposals for enforcing the UK's Online Safety Act include the mandatory use of facial age estimation technology to check users of what?,Social media platforms.
The iconic ‘Goonies’ home was recently sold to a fan of the film for $1.65 million. Which state is the house located in?,"The Goonies house is located in Astoria, Oregon."
The US and which other country this week launched their largest joint military drills in decades in the South China Sea?,The US and Japan launched their largest joint military drills in decades in the South China Sea.
Which of these 2023 NCAA women’s basketball tournament participants did not advance to the Final Four?,This question cannot be answered as the 2023 NCAA women's basketball tournament has not taken place yet.
Workers in which country arrived at work to find a national holiday had been declared overnight?,Workers in Nepal arrived at work to find a national holiday had been declared overnight.
Which food chain is launching a legal battle after being refused a 24-hour licence at its Leicester Square store?,McDonald's
What NHL team in its sixth season routed the Florida Panthers 9-3 this week to capture its first-ever Stanley Cup title?,The Tampa Bay Lightning
The Mexican government is reviving a 100-year-old railway line in a bid to attract container traffic. Which bodies of water will the track connect?,The revived railway line in Mexico will connect the Pacific Ocean and the Gulf of Mexico.
Amazon is growing its footprint in the health sector. Which service did the e-commerce giant launch nationwide this week?,Amazon launched its Amazon Pharmacy service nationwide this week.
Who among the following individuals is a three-time state wrestling champion for Tatnall School and later became an All-American center in football at Alabama?,Barrett Jones
"Amid violent clashes with police, dozens of people were detained this week in which country near Russia?",Belarus
New research shows that global household wealth dropped by how much last year?,"According to new research, global household wealth dropped by $17.5 trillion last year."
One of the longest hot weather streaks in US history finally ended this week. Which city saw temperatures over 110 degrees for 31 consecutive days?,"Phoenix, Arizona"
The Miami Heat eliminated the Milwaukee Bucks from the playoffs. Miami is the first No. 8 seed to win an NBA playoff series since:,The Miami Heat eliminated the Milwaukee Bucks from the playoffs. Miami is the first No. 8 seed to win an NBA playoff series since the Memphis Grizzlies defeated the San Antonio Spurs in the 2011 NBA playoffs.
"A revised red, white and blue flag honoring Juneteenth was introduced in 2000. What symbol is at the center of the flag?","The symbol at the center of the revised red, white, and blue flag honoring Juneteenth is a bursting star."
What is the planned development across from Helen's Sausage House near Smyrna on Route 13?,The planned development across from Helen's Sausage House near Smyrna on Route 13 is a new shopping center called Sunnyside Village.
Which airline hit the headlines after charging an elderly couple £110 to print new boarding passes?,Ryanair
Approximately how many troops does the US maintain in Syria as part of its campaign to defeat ISIS?,"As of October 2021, the US maintains around 900 troops in Syria as part of its campaign to defeat ISIS."
"Which would-be Republican presidential nominee referred to the absent Donald Trump as ""Donald Duck"" during the second GOP debate?",Rand Paul
"Numerous newspapers, including the USA TODAY Network, announced it would drop which comic strip after its creator made racist remarks?","The comic strip that was dropped after its creator made racist remarks was ""Non Sequitur"" by Wiley Miller."
Which awards show announced its 2024 nominees this week?,The Oscars announced its 2024 nominees this week.
Apple on Tuesday unveiled its iPhone 15 lineup. Which current iPhone feature will be significantly altered in the new version?,"The current iPhone feature that will be significantly altered in the new iPhone 15 lineup is the notch. Apple has announced that the notch will be smaller in the new version, allowing for more screen real estate."
Almost $450 million worth of which item was found floating off the coast of Italy?,Sunken treasure.
Which South African politician has been locked in a war of words with billionaire businessman Elon Musk?,South African politician Julius Malema has been locked in a war of words with billionaire businessman Elon Musk.
What does the data from the Delaware Department of Education show about student proficiency in the years following the COVID-19 crisis?,"The data from the Delaware Department of Education shows a decrease in student proficiency in the years following the COVID-19 crisis. This decline is attributed to the disruptions in traditional learning caused by the pandemic, including school closures, remote learning challenges, and social-emotional impacts on students. Efforts are being made to address these learning gaps and support students in catching up on missed education."
Which Spanish city hosted the third European Political Community summit?,Madrid
"What percentage of 16- to 18-year-olds believe the world is “likely” to end in their lifetimes because of climate change, according to a newly published poll?","The percentage of 16- to 18-year-olds who believe the world is ""likely"" to end in their lifetimes because of climate change, according to a newly published poll, is 57%."
Who is permitted to be on the Community Advisory Group for the contaminated East Basin Road Groundwater Superfund site in New Castle?,"The Community Advisory Group for the contaminated East Basin Road Groundwater Superfund site in New Castle is open to any interested community members, including residents, business owners, local government officials, and representatives from environmental organizations."
The world’s last gaslit cinema is reopening in which city?,London
"Racism, sexism, elitism and classism is prevalent at every level in which English sport, according to a new independent report?",Cricket
What is the new COVID-19 variant detected in Delaware called?,The new COVID-19 variant detected in Delaware is called the Delta variant.
Which city was forced to close one of its busiest freeways due to a major fire?,"Atlanta, Georgia"
Which singer is being blamed for higher than expected inflation in Sweden?,This question is not based on factual information and is likely a joke or satire. There is no singer who is being blamed for higher than expected inflation in Sweden.
"Talks between the UK, Spain and the EU over the status of Gibraltar have stalled over what?"," Talks between the UK, Spain, and the EU over the status of Gibraltar have stalled over disagreements regarding the future relationship between Gibraltar and the European Union, particularly in terms of border control, trade, and the movement of people."
Which country declared a state of emergency this week over the threat of a possible volcanic eruption?,The country that declared a state of emergency this week over the threat of a possible volcanic eruption is St. Vincent and the Grenadines.
"Demand in the US surged for which flavored Girl Scout cookie, causing major inventory issues?",Lemon-Ups
Why has London’s Young Vic Theatre issued a trigger warning for audiences of its latest production?,"The Young Vic Theatre in London issued a trigger warning for its latest production due to the sensitive and potentially distressing subject matter depicted in the play, which includes themes of sexual violence and abuse. The warning is intended to alert audience members who may be triggered or upset by such content, allowing them to make an informed decision about whether or not to attend the performance."
General Motors says it will retire which vehicle at the end of the 2024 model year?,The Chevrolet Camaro.
"Which team won’t be going to the NCAA men’s basketball tournament, despite being winning its regular season and conference tournament titles?",The team that won't be going to the NCAA men's basketball tournament despite winning its regular season and conference tournament titles is the Belmont Bruins.
