question,answer
What is the organic compound in turkey that often gets the blame for making you sleepy after Thanksgiving dinner?,The organic compound in turkey that often gets the blame for making you sleepy after Thanksgiving dinner is called tryptophan.
"Before he won this week, how many times had NASCAR driver Ricky Stenhouse Jr. taken home the Daytona 500 championship title?",Ricky Stenhouse Jr. has never won the Daytona 500 championship title before this week.
Which three-Michelin-starred restaurant said to be the world’s best is closing because of ‘unsustainable’ economics?,The three-Michelin-starred restaurant that is said to be the world's best and is closing due to 'unsustainable' economics is Eleven Madison Park in New York City.
A new study found that which UK city is the “gloomiest” in the UK?,Glasgow
"Diane Abbott suggested in a letter to which newspaper that Jewish, Irish and Traveller people are not “all their lives subject to racism”?",The Guardian
Which news organization this week agreed to the largest publicly known defamation settlement in US history?,The news organization that this week agreed to the largest publicly known defamation settlement in US history is The Washington Post.
NASA says an asteroid could hit Earth on what holiday in 2046?,NASA says an asteroid could hit Earth on the holiday of April Fools' Day in 2046.
Erin Brockovich has urged locals of a town in which US state to ignore government safety reassurances after a train carrying toxic waste derailed there?,California
"Which toy will no longer be sold by Amazon, Target and Walmart due to safety concerns?","The toy that will no longer be sold by Amazon, Target, and Walmart due to safety concerns is the Fisher-Price Rock 'n Play Sleeper."
What is the predicted record amount of consumer spending on Halloween costumes and decorations for the 2023 season?,The predicted record amount of consumer spending on Halloween costumes and decorations for the 2023 season is estimated to be around $11.1 billion.
Which classic British television comedy is to be revived?,"The classic British television comedy to be revived is ""The Office."""
South Africa holds a total of how many Rugby World Cup titles after beating New Zealand in this year's tournament final?,South Africa holds a total of three Rugby World Cup titles after beating New Zealand in this year's tournament final.
Which unlikely trade is reportedly losing jobs to AI bots?,The unlikely trade reportedly losing jobs to AI bots is the art of sushi making.
"Which major tech company announced 10,000 job cuts this week?","IBM announced 10,000 job cuts this week."
Which national holiday was celebrated this week?,Independence Day
Mattel said it is planning a relaunch of the Barney franchise. The dinosaur was originally featured in a PBS series that began in which year?,"The Barney franchise originally began in 1992 with the premiere of the PBS series ""Barney & Friends."""
New York City’s new “rat czar” Kathleen Corradi previously worked as what?,Kathleen Corradi previously worked as a deputy commissioner at the New York City Department of Health and Mental Hygiene.
A Spanish TV star sparked controversy by using whose sperm for her surrogate baby?,Cristiano Ronaldo
Which national leader claimed the UN was “losing credibility” as the intergovernmental organisation’s annual assembly kicked off in New York City?,"The national leader who claimed the UN was ""losing credibility"" at the annual assembly in New York City was President Donald Trump of the United States."
"Which member of the UK shadow cabinet branded Suella Braverman as ""out of control"" after the home secretary publicly criticised the Met Police?",Lisa Nandy
Which high-profile billionaire has gained a place in the Guinness Book of World Records for ‘largest ever loss of personal wealth’?,Jeff Bezos
"Which city is home to the best drinking spot anywhere, according to the latest World's 50 Best Bars list?","London, United Kingdom"
Dwayne “The Rock” Johnson announced this week an upcoming live-action remake of which animated film?,"Dwayne ""The Rock"" Johnson announced this week an upcoming live-action remake of the animated film ""The Lion King."""
Which route has been completely canceled by Avelo Airlines?,"Avelo Airlines has completely canceled its route between Hollywood Burbank Airport (BUR) in California and Charles M. Schulz–Sonoma County Airport (STS) in Santa Rosa, California."
"King Charles III ascended to the throne in England after the death of his mother, Queen Elizabeth II. His coronation ceremony was held at London’s Westminster Abbey. Who is next in line after King Charles?","Prince William, Duke of Cambridge, is next in line after King Charles III."
Which musician is being praised for giving “life-changing” bonuses to her truck drivers?,Dolly Parton
"Several powerful tornadoes struck the US this week, leaving thousands without power and some trapped inside shelters. Which state appeared to be the hardest hit?",The state that appeared to be the hardest hit by the powerful tornadoes in the US this week was Kentucky.
"What were the charges that Camden's former mayor, Justin T. King, pleaded guilty to in the plea deal related to the February incident?","Justin T. King, Camden's former mayor, pleaded guilty to charges of wire fraud and filing a false tax return in the plea deal related to the February incident."
"Men who use what more than 20 times a day have a higher risk of low sperm count, according to a new study?","Men who use their smartphones more than 20 times a day have a higher risk of low sperm count, according to a new study."
Pupils at an independent school in North London have voted to make what change to their lunches?,To make their lunches completely vegetarian.
NFL safety Damar Hamlin was hospitalized this week after suffering a cardiac arrest during a game on Monday. What team does he play for?,Damar Hamlin plays for the Pittsburgh Steelers.
"Scientists have warned that a 5,000-mile-long mass of what species of seaweed is drifting towards Florida’s coast?","Scientists have warned that a 5,000-mile-long mass of Sargassum seaweed is drifting towards Florida's coast."
What was the final score in the penalty shoot-out for the FA Community Shield last weekend?,The final score in the penalty shoot-out for the FA Community Shield last weekend was 5-4 in favor of Liverpool.
Which US President signed a bill making Juneteenth a federal holiday?,Joe Biden
Which football conference will Delaware be joining in 2025 after moving up to the Football Bowl Subdivision (FBS)?,Delaware will be joining the Sun Belt Conference in 2025 after moving up to the Football Bowl Subdivision (FBS).
True or false: Travelers from China to the U.S. are no longer required to present a negative COVID-19 test before boarding their flights.,False. Travelers from China to the U.S. are still required to present a negative COVID-19 test before boarding their flights.
What is the name of the new Covid variant triggering a surge of infections in India?,The name of the new Covid variant triggering a surge of infections in India is the Delta variant.
"Italy’s Supreme Court has ordered a city council in Lombardy to pay a couple €50,000 (£43,000) for failing to safeguard them against what?",Flooding.
What was the name of the country music festival where the deadliest mass shooting in American history occurred?,The name of the country music festival where the deadliest mass shooting in American history occurred was the Route 91 Harvest Festival.
Which celebrity recently broke the internet by showing off a baby bump?,Kylie Jenner
The Biden administration is monitoring a potentially major labor strike brewing in which industry?,The Biden administration is monitoring a potentially major labor strike brewing in the healthcare industry.
A Food and Drug Administration advisory committee endorsed over-the-counter sales of what drug this week?,"The Food and Drug Administration advisory committee endorsed over-the-counter sales of the drug Plan B, also known as the morning-after pill, this week."
Australia beat England by two wickets in a thrilling first Test of the men’s Ashes series that was played where?,"The first Test of the men's Ashes series between Australia and England was played at the Gabba in Brisbane, Australia."
"A member of which band said he used artificial intelligence to create his iconic group's ""last record""?","Brian Eno, a member of the band Roxy Music, said he used artificial intelligence to create the band's ""last record""."
"Which sports brand faced a backlash after claiming its £45 trainers for babies ""help promote natural foot development""?",Nike
People around the world showed their support for World Lupus Day by wearing which color?,Purple
Which pop icon will embark on her 40th anniversary tour this year?,Madonna
"What inspired Thomas Jackson to start his clothing line, ""Carry My Own Weight""?","Thomas Jackson was inspired to start his clothing line, ""Carry My Own Weight,"" after overcoming personal struggles and challenges in his life. He wanted to create a brand that promoted self-reliance, empowerment, and resilience, encouraging individuals to take control of their own lives and destinies. The name ""Carry My Own Weight"" symbolizes the idea of shouldering one's own burdens and responsibilities, and not relying on others to do it for them."
Which countries will host matches in the unprecedented six-nation 2030 FIFA World Cup?,"The unprecedented six-nation 2030 FIFA World Cup will be hosted by Argentina, Uruguay, Paraguay, and Chile in South America, as well as by Spain and Portugal in Europe."
Which former “Friends” cast member received a star on the Hollywood Walk of Fame during a ceremony this week?,Jennifer Aniston
Earth saw its hottest day on record this week. What was the global temperature on Tuesday that exceeded all previous records?,The global temperature on Tuesday that exceeded all previous records was 130 degrees Fahrenheit.
Ukrainian President Volodymyr Zelenskyy made his second known trip outside Ukraine since Russia's invasion this week. Where did he go?,Volodymyr Zelenskyy made his second known trip outside Ukraine since Russia's invasion to the United Arab Emirates.
Which country was devastated by an unprecedented attack this week by the Hamas militant group?,Israel
Memorial Day weekend is upon us. Which movie is considered to be the first summer blockbuster?,"""Jaws"" is considered to be the first summer blockbuster movie. Released in 1975 and directed by Steven Spielberg, it set the standard for the modern blockbuster and became a cultural phenomenon."
"What is the primary issue discussed in the article "" 'Beats living on the streets:' The Delawareans who call motels home during the holidays""?","The primary issue discussed in the article "" 'Beats living on the streets:' The Delawareans who call motels home during the holidays"" is the issue of homelessness and the challenges faced by individuals and families who are living in motels as a temporary housing solution during the holiday season."
What was the final score in last weekend's Premier League classic clash between Chelsea and Manchester City?,The final score in last weekend's Premier League classic clash between Chelsea and Manchester City was 2-1 in favor of Chelsea.
"On July 4, 1776, the Continental Congress adopted the Declaration of Independence at a meeting in which city?",Philadelphia
Around what percentage of Americans get their flu shot each year?,Approximately 45-50% of Americans get their flu shot each year.
This week marked 50 years since which major technological milestone?,"The major technological milestone that marked its 50th anniversary this week is the Apollo 11 moon landing, which took place on July 20, 1969."
YouTube legend MrBeast is facing criticism for doing what in his latest online stunt?,"In his latest online stunt, YouTube legend MrBeast is facing criticism for planting 20 million trees as part of a fundraising campaign called #TeamTrees. Critics argue that the environmental impact of planting non-native trees in certain areas could potentially do more harm than good."
Which country experienced a nationwide power outage this week?,India
Which war-torn region have UN officials recently described as “apocalyptic” with “no place safe to go?”,Yemen
Which Supreme Court justice – already in hot water over gifts from a donor – was found to have claimed income from a defunct real estate firm?,Justice Clarence Thomas
What percentage of British adults think that King Charles is doing a “good job” as monarch?,"As of the latest survey data, approximately 70% of British adults think that King Charles is doing a ""good job"" as monarch."
Which movie theater chain announced plans to price tickets based on seat location within the auditorium?,AMC Theatres announced plans to price tickets based on seat location within the auditorium.
"More than 70,000 festival attendees were stranded in the Nevada desert when torrential rain overwhelmed their campsites with ankle-deep mud. What was the name of the festival?",Burning Man
King Charles reportedly said that the “secret” to a good kebab is what?,"The ""secret"" to a good kebab, according to King Charles, is to use only the finest cuts of meat and to marinate them in a blend of spices for at least 24 hours before grilling."
"According to early polling, which candidate appears to be the most likely Republican nominee in next year’s presidential election?","As of now, early polling suggests that former President Donald Trump is the most likely Republican nominee in next year's presidential election."
"On what date did Randon Wilkerson brutally attack Delmar Police Cpl. Keith Heacook, leading to his death?","Randon Wilkerson brutally attacked Delmar Police Cpl. Keith Heacook on April 25, 2021, leading to his death."
"More than half of US adults claim to have been visited by what in a dream, according to a new survey?",A deceased loved one
"While historical accounts of what was eaten at the first Thanksgiving vary, which food was definitely not on the menu?",Potatoes.
"President Abraham Lincoln’s famous Gettysburg Address in 1863 during the height of the Civil War begins, “Four score and seven years ago …” How long is a score?","A score is equal to 20 years. So, four score and seven years ago would be 87 years ago."
The protection provided by Covid-19 vaccines begins to wane after how many months?,The protection provided by Covid-19 vaccines begins to wane after around 6 to 8 months.
The RSPCA issued a warning about a rise in escapes by which increasingly popular exotic pets?,"The RSPCA issued a warning about a rise in escapes by sugar gliders, which are increasingly popular exotic pets."
"Which state is now home to America’s highest gas prices, taking the crown from California?",Hawaii
Elon Musk said he’s cut approximately how much of Twitter’s staff?,Elon Musk said he's cut approximately 9% of Twitter's staff.
"The CDC declared measles was eliminated from the US in 2000. However, a new case was reported this week in which state?",The new case of measles was reported this week in the state of New Hampshire.
"Which type of structure recently collapsed in India, trapping dozens of workers?","A building under construction collapsed in India, trapping dozens of workers."
New research found that which UK coffee chain brews up the most caffeine-packed cappuccinos?,Costa Coffee
America’s banking system was widely impacted this week by which issue?,The issue that widely impacted America's banking system this week was the collapse of a major financial institution.
Where did the Pilgrims celebrate the first Thanksgiving?,"The Pilgrims celebrated the first Thanksgiving in Plymouth, Massachusetts."
Which film star is on trial in Utah over a “hit and run” skiing accident?,Matthew McConaughey
Customs agents at a Minnesota airport seized a box of giraffe poo from a woman who wanted to use the droppings to make what?,The woman wanted to use the giraffe poo to make paper.
What is the significance of Barratt’s Chapel and Cemetery?,"Barratt's Chapel and Cemetery is significant as the birthplace of American Methodism. It was at Barratt's Chapel in Frederica, Delaware, that the Methodist Episcopal Church was officially organized in 1784. The chapel and cemetery serve as important historical landmarks in the development of Methodism in the United States."
A major strike this week halted classes for more than a half million students in which city?,Chicago
Which invasive host tree appears to be the preferred choice for spotted lanternflies to lay their egg masses on?,The invasive host tree that appears to be the preferred choice for spotted lanternflies to lay their egg masses on is the Tree of Heaven (Ailanthus altissima).
Tens of thousands of people in China have left their homes in the past several days due to which damaging weather event?,Tens of thousands of people in China have left their homes in the past several days due to the damaging weather event of Typhoon In-Fa.
Federal prosecutors this week charged Rep. George Santos with which of the following:,Federal prosecutors this week charged Rep. George Santos with wire fraud and making false statements to a financial institution.
"What is the name of the 1,500-square-mile iceberg that is on the move after breaking away from Antarctica?","The name of the 1,500-square-mile iceberg that is on the move after breaking away from Antarctica is A-68a."
"People magazine published snippets of Britney Spears' memoir on Tuesday, ahead of its release next week. What is the book called?","The book is called ""Heart of Glass."""
King Charles’s coronation procession route from Buckingham Palace to Westminster Abbey covers a distance of how much?,The coronation procession route of King Charles from Buckingham Palace to Westminster Abbey covers a distance of approximately 2.8 miles.
"While many US industries have recovered from the Covid-19 pandemic, which major sector still has a huge shortage of workers?",The major sector that still has a huge shortage of workers in the US despite the recovery from the Covid-19 pandemic is the healthcare industry.
Who interviewed Ghislaine Maxwell on TalkTV this week?,Piers Morgan interviewed Ghislaine Maxwell on TalkTV this week.
"What is the name of SpaceX's rocket, which exploded shortly after lifting off on its first test flight this week?",The name of SpaceX's rocket that exploded shortly after lifting off on its first test flight is Falcon 1.
"Taylor Swift and Beyoncé dominated the entertainment headlines, thanks to their blockbuster worldwide tours and concert films released in theaters. Beyoncé also set a record for the most Grammy Awards. How many has she won?",Beyoncé has won a total of 28 Grammy Awards.
Dolly Parton broke the Guinness World Record for the most studio albums by a female country singer with how many releases?, Dolly Parton broke the Guinness World Record for the most studio albums by a female country singer with 47 releases.
A swimwear trend known as what is taking hold on China’s beaches?,"The answer is ""facekinis."""
Which university’s football team declined an invitation this week to the White House?,The University of Alabama's football team declined an invitation to the White House this week.
Former WNBA MVP Breanna Stewart became one of the latest stars to switch teams. Who will she play for next season?,Breanna Stewart will play for the Seattle Storm next season.
"South Carolina star Aliyah Boston was the first pick in this week’s WNBA Draft. In total, how many South Carolina players were drafted Monday?",Three South Carolina players were drafted on Monday.
"Why is Fort Delaware known to be such an eerie place according to Daryl Marston from ""Ghost Hunters""?","Fort Delaware is known to be such an eerie place because it served as a prison camp during the Civil War, where thousands of Confederate soldiers were held in deplorable conditions. Many prisoners died due to disease, malnutrition, and harsh treatment, leading to reports of paranormal activity and ghostly sightings at the fort."
"HBO's ""Succession,"" which aired its series finale this week, centers on the (fictional) Roy family, the owners of what company?",Waystar Royco
"In what may be the largest cattle killing ever, how many cows died in an explosion and fire at a dairy farm in Texas?","In the largest cattle killing ever, approximately 500 cows died in an explosion and fire at a dairy farm in Texas."
Who ended Max Verstappen’s 10-race winning streak by claiming victory at the Singapore Grand Prix?,Lewis Hamilton
President Joe Biden welcomed which world leader to the White House for a state dinner this week?,"President Joe Biden welcomed the Prime Minister of Japan, Yoshihide Suga, to the White House for a state dinner this week."
The vice president of which Middle Eastern country is funding a bid to take control of the UK's Telegraph newspaper group?,Saudi Arabia.
Which signature drink did Starbucks reintroduce to its menu this week?,The signature drink that Starbucks reintroduced to its menu this week is the Pumpkin Spice Latte.
TV producers feared which broadcaster would catch avian flu while filming his latest series?,David Attenborough
"Following years of speculation, which popular 1980s film finally has a sequel in the works?","The popular 1980s film that finally has a sequel in the works is ""Top Gun."""
Which Salesianum School senior won the 215-pound title in the 30th edition of the Beast of the East wrestling tournament held on Sunday at the Carpenter Center?,Tommy Pomara
Who was criticised for saying Brits need to accept being “worse off” financially?,"Former Prime Minister Theresa May was criticized for saying Brits need to accept being ""worse off"" financially during the Brexit negotiations."
"As Russia’s war in Ukraine raged, a mercenary group attempted an insurrection against President Vladimir Putin. The Wagner Group’s leader later died in a plane crash. What was his name?",Dmitry Utkin
"Which Satellite TV provider was hit with a $150,000 fine for failing to properly dispose of one of its satellites in space?",DirecTV
Police Scotland is facing a flood of complaints from officers over a new policy requiring them to do what?,Wear body cameras while on duty.
What was one of the key issues mentioned in the lawsuit against Regal Builders LLC?,"One of the key issues mentioned in the lawsuit against Regal Builders LLC was the alleged use of substandard materials in the construction of residential properties, leading to structural defects and safety concerns for homeowners."
Which tech company is moving forward with its plan to delete accounts that have been inactive for at least two years?,Twitter
"What is the purpose of the $750 million in federal funding awarded to Delaware, Pennsylvania, and New Jersey for the Mid-Atlantic Hydrogen Hub?","The purpose of the $750 million in federal funding awarded to Delaware, Pennsylvania, and New Jersey for the Mid-Atlantic Hydrogen Hub is to support the development of a regional hydrogen hub that will produce, store, and distribute clean hydrogen energy. This initiative aims to reduce greenhouse gas emissions, create jobs, and promote economic growth in the region."
"Which state is now home to America’s highest gas prices, taking the crown from California?",Hawaii
Who was sitting on the throne in England when the American colonies declared independence?,King George III was sitting on the throne in England when the American colonies declared independence.
What is the main concern expressed by residents of West Center City in Wilmington regarding the Neighborhood Stabilization Program led by Mayor Mike Purzycki?,Residents of West Center City in Wilmington have expressed concerns about the lack of transparency and community input in the Neighborhood Stabilization Program led by Mayor Mike Purzycki. They feel that decisions are being made without considering the needs and opinions of the residents who will be directly affected by the program.
The arrival carpet at this Sunday’s Oscars will not be its usual red. What color will it be?,The arrival carpet at this Sunday's Oscars will be gold.
World leaders gathered at the annual United Nations General Assembly summit this week. Where is the UN headquartered?,"The United Nations is headquartered in New York City, United States."
What is the reason behind McDonald's decision to remove self-serve soda machines from U.S. locations by 2032?,"The reason behind McDonald's decision to remove self-serve soda machines from U.S. locations by 2032 is to reduce the spread of germs and improve overall cleanliness and hygiene in their restaurants. By eliminating self-serve soda machines, McDonald's aims to create a safer and more sanitary dining experience for their customers."
Many Ohio residents are concerned about their health after a train carrying hazardous materials derailed there two weeks ago. Which chemical are they most worried might still be lingering in the area?,The chemical that Ohio residents are most worried about lingering in the area after the train derailment is likely to be chlorine gas.
"More than 100,000 homes and businesses lost power this week across the Southern US due to which kind of severe weather event?","The severe weather event that caused more than 100,000 homes and businesses to lose power across the Southern US this week was a series of powerful thunderstorms with high winds and lightning."
"Vivek Ramaswamy, biotech entrepreneur and author from Ohio, entered the Republican presidential primary race. He wrote a book titled:","""WOKE, INC.: Inside Corporate America's Social Justice Scam"""
