question,answer
Why can't you identify a duck from other poultry?,"I can identify a duck from other poultry based on the physical characteristics and behaviors described in the context. Ducks have broad bills, eyes on the side of the head, webbed feet, and feed by dabbling in shallow water with their tails upended. They are also social birds that prefer to live and move around in groups. These distinguishing features help differentiate ducks from other poultry species."
How much money was allocated to advertise Windows 9?,The question is not answerable as there is no specific information provided about the amount of money allocated to advertise Windows 9. The context only mentions the advertising budget for Windows 8 and its related campaign activities.
What type of oils does Canadian bitumen differ substantially from?,Canadian bitumen differs substantially from synthetic oil.
Where do microbes transfer material from their chloroplast and mitochondrial genomes?,The question is not answerable based on the provided context as it does not specify where exactly microbes transfer material from their chloroplast and mitochondrial genomes. The context only mentions that genetic material from these genomes has been transferred to nuclear chromosomes in eukaryotic cells.
What dialects of the southern group are spoken on the saarte murre?,The question is answerable. The dialects of the southern group spoken on the saarte murre are the dialects of Saaremaa and Hiiumaa.
What does the whip organization play a role in forming in conjunction with party leaders?,"The whip organization plays a role in ensuring party discipline and unity by communicating with party members and gathering information on their views and sentiments regarding legislation under consideration. They assist party leaders, including the floor leader, in strategizing and coordinating efforts to promote or oppose legislation in line with the party's objectives."
What is underspecified for voicing and unaspiratoin?,"The question is not answerable because in native Dravidian words, stops are underspecified for voicing and aspiration."
What has been funded as part of the news-related initiatives?,"The question is not answerable with respect to the provided context as it is focused on education-related initiatives funded by the foundation, not news-related initiatives."
What studio was built on a 230-km² converted farm?,Universal City Studios was built on a 230-acre converted farm.
What kinds of buildings and building developments are the old movements not in favor of?,"The old movements are not in favor of modernist and globally uniform architecture, as well as solitary housing estates and suburban sprawl."
What prepares the brain to recieve rational thought?,"The brain is prepared to receive rational thought through the interaction of reason with sensation, according to Avicenna's philosophy. Sensation prepares the soul to receive rational concepts from the universal Agent Intellect, allowing for the development of rational thought processes."
What percentage of Estonians spoke Russian in 2000?,"The question is not answerable as it is asking for the percentage of Estonians who spoke Russian in 2000, but the context provided only mentions the percentage of non-Estonians who adopted the Estonian language in Estonia at that time."
What genre was not eclectic?,"The question is not answerable because it is asking for a genre that was not eclectic, but the context provided describes post-punk as an eclectic genre that influenced the development of various subsequent genres. Therefore, there is no specific genre mentioned in the context that was not eclectic."
In what year was Arsenal founded?,Arsenal Football Club was founded in 1886.
What section of the Tanakh encouraged intermarriage? ,"The question is not answerable as there is no specific section of the Tanakh that encourages intermarriage. In fact, historical interpretations and teachings from Jewish sages have warned against intermarriage between Jews and non-Jews."
"Simple organisms can occupy this, that are not available to their simpler brethern?",The question is not answerable as it is unclear what specific ecological niches are being referred to in the context provided.
How many signatures were collected by ARV?,"The question of how many signatures were collected by ARV is not answerable based on the provided context. The context mentions that 250,000 signatures were collected by MSF (Médecins Sans Frontières), but it does not specify if ARV collected any signatures or how many if they did."
By what name is the last standardized version of the Quran known?,The last standardized version of the Quran is known as Uthman's codex.
What was coal tar derived from?,Coal tar was derived from aniline.
What ethnicity made up 19.5.% of San Diego's population in 2009?,The question is not answerable based on the provided context as it does not specify which specific ethnicity made up 19.5% of San Diego's population in 2009.
Certain species of wood lice are native to Great Britain but not where?,Certain species of wood lice are native to Ireland but not Great Britain.
What is the most rare use for zinc?,The question is not answerable as there is no specific information provided about rare uses of zinc.
Which country doesn't need a similarity requirement to determine if the work was copied?,There is no country that does not have some form of similarity requirement to determine if a work was copied. The concept of substantial similarity or equivalence is a fundamental aspect of copyright law across different jurisdictions.
What is the determining factor where zinc and magnesium are very different chemically?,The determining factor where zinc and magnesium are very different chemically is their tendency to form bonds with a greater degree of covalency and the stability of complexes they form with different donors.
What was the guiding motto of Pope Pius XI?,"The guiding motto of Pope Pius XI was ""Obedientia et Pax"" (Obedience and Peace)."
What contains a distribution of uranium deoxidation species in various forms ranging from most oxidized to least oxidized?,Calcined uranium yellowcake contains a distribution of uranium deoxidation species in various forms ranging from most oxidized to least oxidized.
What are Russians most dissimilar from autosomally?,"The question of what Russians are most dissimilar from autosomally is not directly answerable based on the provided context. While it is mentioned that some northern Russians have intermediate genetic characteristics between Slavic and Finno-Ugric groups, the specific details of their dissimilarity from other populations in terms of autosomal genetics are not provided. Therefore, it is not possible to give a definitive answer to this question."
 What does Zhe mean in Japanese?,"Zhe in Japanese does not have a direct translation or meaning as it is a Chinese character used in the name of the Zhe River in China. Therefore, it is not answerable in the context of Japanese language."
How does photographic ecotourism help preserve wildlife in Africa?,"Photographic ecotourism can help preserve wildlife in Africa by providing a sustainable and non-consumptive alternative to trophy hunting. It allows tourists to observe and appreciate wildlife in their natural habitats without causing harm. Additionally, revenue generated from photographic ecotourism can directly benefit local communities and conservation efforts, leading to long-term conservation success. However, it is important to note that the effectiveness of photographic ecotourism in preserving wildlife may vary depending on various factors such as management practices, community involvement, and government policies."
Who has a lesser history of unitary states? ,North America has a lesser history of unitary states compared to Europe.
What was the required quality of the pitch before 2015-16?,The required quality of the pitch before the 2015-16 season was FIFA One Star for regular ties and FIFA Two Star for ties involving one of the 92 professional clubs.
What was Augustin Louis Cauchy's nationality?,Augustin Louis Cauchy was a French mathematician.
What did the use of the speed of light by Newton lead to?,"The use of the speed of light by Newton did not directly lead to any significant developments in physics. It was Einstein who introduced the concept of the constant speed of light as a fundamental principle in his theory of special relativity, which revolutionized our understanding of time and space."
Electricity production is expected to increase by what percentage each year for the next 15 years?,"This question is not answerable based on the provided context as it specifically mentions the expected increase in hydroelectricity production by 3.1% each year for the next 25 years, not 15 years."
What type of comic has taken off in the 20th century?,"The question is not answerable as it is too broad and does not specify a particular type of comic. The 20th century saw the rise of various types of comics, including comic strips, editorial cartoons, comic books, and graphic novels, among others. Each of these types has had its own impact and popularity during different periods of the 20th century."
Who captured Multan in 1761?,Ahmad Shah Abdali captured Multan in 1761.
How far is Puerto Rico from St. Kitts?,Puerto Rico is 240 kilometers (150 miles) west of St. Kitts.
When was the October Countercurrent?,"The question about the October Countercurrent is not answerable based on the provided context. The information given only discusses the February Countercurrent in 1967, but there is no mention of an October Countercurrent."
What does a common browser identify?,A common browser identifies a resource to be retrieved over the Hypertext Transfer Protocol (HTTP) when a Uniform Resource Locator (URL) is inputted by the user.
Which of Southwestern's schools are among the most academically productive in the nation?,"The question is not answerable in the given context as it is focused on Northwestern University, not Southwestern University."
How many pages of public documents were microfilmed?,"The question is answerable. Some 9,800 pages of public documents were microfilmed by the German Foreign Office from 1933 onwards."
Where did Miami music gain popularity in the Middle East?,The question is not answerable with the provided context as there is no specific information given about where Miami music gained popularity in the Middle East.
What country had a weak hold by the EIC after the formal end of the Maratha empire?,The question is not answerable as it does not specify a particular country or region. The context provided only mentions the areas where the British East India Company gained control after the formal end of the Maratha empire in India.
What event occurred approximately 2.3 million years ago?,"The event that occurred approximately 2.3 billion years ago was the Great Oxidation Event, not 2.3 million years ago."
Why is the concentrate of uranium in farmland so low?,"The concentrate of uranium in farmland is relatively low compared to other substances because uranium is naturally found in low concentrations in the Earth's crust. Additionally, the use of phosphate fertilizers in farmland can slightly increase the concentration of uranium in the soil, but it still remains relatively low compared to other elements."
What is the latin name for the flying squirrel?,The latin name for the flying squirrel is Glaucomys.
What did Popper think the weakness of a scientific theory lay in?,Popper believed that the weakness of a scientific theory lay in its inability to be falsified by criticism.
"Typically, what is the capital ship of no fleets?","This question is not answerable as it is asking for the capital ship of no fleets, which does not align with the context provided about aircraft carriers being the capital ship of a fleet."
The Declaration of Westminster came into being in what year?,The Declaration of Westminster came into being in 1931.
When was Antarctica last seen by humans?,"Antarctica was last seen by humans in the early 19th century, specifically in 1820 when the Russian expedition led by Fabian Gottlieb von Bellingshausen and the British expedition led by Edward Bransfield sighted the continent."
How many explanations were there for the lack of change in Mishnaic times?,There were two explanations provided by historian Shaye J. D. Cohen for the lack of change in Mishnaic times regarding the status of the offspring of mixed marriages.
Which article did not allow the division of territory comprising Baden?,The question is answerable. The article that did not allow the division of territory comprising Baden was Article 118.
What dialect is Min closely related to?,Min is closely related to the Teochew dialect.
 What percentage of total waste can not be attributed to paper?,"This question is not directly answerable based on the provided context. The information given only specifies the percentage of total waste that can be attributed to paper (40%), but it does not provide information on the percentage of waste that cannot be attributed to paper. Therefore, it is not possible to determine the exact percentage of total waste that cannot be attributed to paper from the information provided."
What did Harriet Harman emphasize? ,"Harriet Harman emphasized the importance of gender equality, social justice, and women's rights during her time in politics."
What reproductive method spread widely but made plants fragile?,"The question is not answerable as it is asking about a reproductive method that made plants fragile, but the context provided only discusses the effectiveness of flowering as a means of reproduction. The context does not mention any specific reproductive method that made plants fragile."
What happened in 1944?,"The question ""What happened in 1944?"" is not directly answerable based on the provided context, as the information provided mainly focuses on events and developments in China after 1949, particularly during the Cultural Revolution. The context does not mention any specific events or significant occurrences in 1944. Therefore, it is not possible to provide a relevant answer to the question."
What is the current unofficial name of Russia?,"The current unofficial name of Russia is not specified in the provided context. Therefore, it is not answerable."
What are two examples of methods and theories of cognitive anthropology?,"Two examples of methods and theories of cognitive anthropology include the use of cognitive psychology experiments to study how cultural beliefs and practices shape perception and behavior, and the application of evolutionary biology principles to understand how cognitive processes have evolved in different cultural contexts."
Verse 2:111 of the Quran supports which aspect of nonscientific thought and practice?,Verse 2:111 of the Quran supports the aspect of requiring proofs and evidence in matters of theological belief and natural science.
When are Internet Archive timestamps harmful for patent offices?,"Internet Archive timestamps can be harmful for patent offices when they are not considered reliable or authoritative sources of information. If there are doubts about the accuracy or authenticity of the timestamps provided by the Internet Archive, it could potentially lead to incorrect determinations of prior art in patent applications. Therefore, it is important for patent offices to ensure that the Internet Archive timestamps meet certain requirements and standards before accepting them as evidence."
When did linguistic studies begin?,"Linguistic studies, particularly in the context of Slavic languages, began as early as 1833 when Slavic languages were recognized as Indo-European."
What does not come in a range of shapes and sizes?,It is not possible to answer this question as the context provided does not specify any item or object that does not come in a range of shapes and sizes.
How many LEGAT offices does the CIA operate?,"The question is not answerable as it pertains to the CIA, not the FBI. The context provided only mentions the FBI's LEGAT offices, not the CIA's. Therefore, it is unclear how many LEGAT offices the CIA operates."
What do the buses look like in Strasbourg?,"The question is asking about the appearance of buses in Strasbourg, but the context provided only mentions the tramway system and bike-sharing scheme operated by the Compagnie des Transports Strasbourgeois (CTS). Since there is no information about the buses in Strasbourg provided in the context, it is not possible to answer the question accurately."
Oxygen represents a store of potential energy that can be released by what?,Oxygen represents a store of potential energy that can be released by nuclear fusion.
What is the scientific name of the oak tree?,The scientific name of the oak tree is Quercus.
What drug killed 1900 people in 1937?,"The drug that killed 1900 people in 1937 was not Elixir Sulfanilamide, but rather a different drug called ""Elixir Sulfanilamide"" manufactured by S.E. Massengill Company of Tennessee."
Where did Northwestern University opened an additional campus at in 2007?,The question is not answerable based on the provided context as it does not mention any additional campus opened by Northwestern University in 2007.
"In pinyin, tenuis consonants are written how?","In pinyin, tenuis consonants are written with letters that represent voiced consonants in English."
What opened in 1995 as the oldest agency division?,The question is not answerable based on the provided context. The information given does not specify any agency division that opened in 1995 as the oldest.
Who was one of the prominent Etonians who died in the Boer War?,One of the prominent Etonians who died in the Boer War was Rupert Brooke.
Which journalist criticized IGN for its controls?,"IGN criticized Twilight Princess for its blurry textures and low-resolution characters, as well as its MIDI-formatted songs lacking the punch and crispness of orchestrated counterparts."
What is fixed-width one byte?,"Fixed-width one byte does not exist in the context of Unicode. Unicode primarily uses UTF-16 as the internal character encoding, which is a variable-width encoding system. Therefore, the concept of fixed-width one byte is not applicable in this context."
What is the lowest temperature state in the US?,"The lowest temperature state in the US is Alaska, not Florida."
What did Gephardt have more of than any other candidate in 2004?,Gephardt had more individual contributions than any other candidate in 2004.
How many pounds of pesticide are used by the US government?,"The question of how many pounds of pesticide are used by the US government is not directly answerable based on the provided context. The information given focuses on the total pesticide use in the US, including various sectors such as agriculture, industrial, commercial, governmental, and home & garden. It does not specifically break down the amount used by the US government alone."
The sovereign has 25 days to give his or her assent according to what article?,"The question is not answerable as it is based on incorrect information. According to the provided context, the sovereign has 15 days, not 25 days, to give his or her assent according to Article 91 of the Spanish constitution."
How often are in-house academic journals published typically?,"The question is not answerable with the provided context as it does not specify which specific in-house academic journals at Washington University are being referred to. Each academic journal may have its own publication schedule, so it is not possible to provide a general answer without more specific information."
What is always used the same way across fields?,"The question is not answerable in this context because the term ""matter"" is not used the same way across fields. Different fields of science have different definitions and interpretations of the term ""matter"", making it impossible to identify a universal usage."
What is dystropy?,"The question is not answerable as ""dystropy"" is not a recognized term in the context provided. It is possible that the term was meant to be ""entropy,"" which is discussed in the context. If the question is indeed referring to ""entropy,"" then it is a measure of the evenness of energy distribution in a system."
What 1974 album by Bad Company was an international flop?,The question is not answerable as it does not provide any information about a specific 1974 album by Bad Company that was an international flop.
What coats uranium metal in liquid?,"The question is not answerable as it does not specify a particular liquid in which the uranium metal is being coated. The context provided only mentions the reaction of uranium metal with various elements and compounds, as well as its behavior in different environments. Without more specific information about the liquid in question, it is not possible to provide a definitive answer."
The white makeup of the city was 37.0% white during which U.S. Census?,"The question is not answerable as the provided context states that the white makeup of the city was 73.0% during the 2010 U.S. Census, not 37.0%."
Who discouraged peaceful coexistence with the Christians in Syria?,The question is not answerable based on the provided context as it states that Muawiyah encouraged peaceful coexistence with the Christian communities in Syria.
What makes up combined phonemes?,"Combined phonemes are made up of different combinations of consonants and vowels that are considered as single units of sound in a language. In the context provided, tenuis and aspirated consonants are examples of combined phonemes in certain languages where they are phonemic and distinguish words from each other."
What year did an incident reduce additional time?,The question is not answerable as it is unclear which specific incident is being referred to in relation to reducing additional time.
Which people wouldn't Mohammad's critics have compared him to at the time?,"Muhammad's critics would have compared him to possessed men, soothsayers, or magicians at the time."
What do information resources allow to pop-up in a window?,"Information resources such as websites, documents, images, videos, and other content can pop-up in a window when a user clicks on a link or interacts with a specific element on a webpage. However, it is important to note that pop-up blockers in web browsers can prevent certain information resources from popping up without the user's consent."
When did New Zealand join the Commonwealth of Nations?,New Zealand joined the Commonwealth of Nations on 28 August 1970.
Voiced symbols are seldom what?,"The question is not answerable as it is incomplete. It seems to be asking what voiced symbols are seldom, but it does not provide enough information or context to determine what is being referred to."
Which European government never contributed to the UNFPA in 2008?,"The question is not answerable as it is not specified which European government did not contribute to the UNFPA in 2008. The context only provides information about the contributions made by several European governments and the European Commission, but it does not mention any specific government that did not contribute."
What did Whitehead believe regarding factors that don't limit people's understanding of his concepts?,"Whitehead believed that the limitations of language and everyday speech should not prevent people from realizing that material substances or essences are a convenient generalized description of a continuum of particular, concrete processes. He emphasized the importance of understanding that things are constantly changing and evolving, rather than remaining fundamentally the same."
Where were all variants of Albanian used?,"The question of where all variants of Albanian were used is not answerable based on the provided context. The text primarily discusses the language policy and usage of Serbo-Croatian variants in Yugoslavia, not Albanian."
How long does it take a boat to go from the U.S. Mainland to Guam?,"The question is not directly answerable as it does not specify the type of boat, speed of the boat, or specific starting point on the U.S. Mainland. Additionally, the context provided only mentions mail delivery times, not boat travel times."
What hurricane hit Charleston in 1998?,"Hurricane Hugo hit Charleston in 1989, not 1998."
"Besides cumulonimbus, what types of clouds are lower and warmer?",Stratus and Stratocumulus clouds are examples of lower and warmer clouds besides cumulonimbus.
The term comics doesn't refer to what?,The term comics doesn't refer to a specific genre or style of storytelling.
Where can the most differences in Praha be found besides vocabulary?,"The question is not entirely answerable based on the provided context. The differences in Praha between Czech and Slovak primarily stem from orthographies, morphological formations, colloquial vocabulary, and some scientific terminology. However, without further information on specific aspects of Praha being referred to, it is challenging to pinpoint where the most differences can be found besides vocabulary."
By who was the Las Gerritsz captained?,The Las Gerritsz was captained by Claes Gerritsz Bierenbroodspot.
How many speakers of Tigrinya are there in the world?,"Based on the context provided, it is not possible to accurately determine the exact number of speakers of Tigrinya in the world. The information only specifies the number of Tigrinya speakers in Eritrea in 2006, which was 2,540,000 out of a population of 5,254,000. Therefore, the question of how many speakers of Tigrinya there are in the world cannot be answered with the given information."
