question,answer
What single type of rock formed Greenstone belts?,"Greenstone belts are typically formed from a combination of high-grade metamorphic rocks derived from volcanic island arcs and low-grade metamorphic rocks representing deep-sea sediments eroded from neighboring island arcs. Therefore, it is not accurate to say that a single type of rock formed Greenstone belts."
"Besides parking requirements, what land use regulations does Texas have?","Besides parking requirements, Texas also has land use regulations such as mandatory lot size for single-family houses and requirements for parking availability to tenants and customers."
What title is given to the newest member of the order of cardinal priests?,"The title given to the newest member of the order of cardinal priests is not specified in the provided context. The title of cardinal protopriest is given to the longest-serving member, not the newest member. Therefore, the question is not answerable based on the information provided."
Who created the Avengers?,The Avengers were created by writer-editor Stan Lee and artist Jack Kirby.
When was FLNG technology created?,"FLNG technology was created in the mid-20th century, building upon LNG developments that were pioneered during that time."
What company was dissolved before the Indian Rebellion?,The company that was dissolved before the Indian Rebellion was the British East India Company.
What kind of vowels have no distinction in Old English?,The question is not answerable based on the provided context.
When did ITU-R start trying to work towards setting a single international DVD standard?,"The question is not answerable as it pertains to the establishment of a single international DVD standard, which is not mentioned in the provided context. The context specifically discusses the efforts of ITU-R towards setting a single international HDTV standard in the 1980s."
What is the official name of the Red Book?,The official name of the Red Book is Compact Disc Digital Audio (CD-DA).
Which languages are not considered to be related to the Italian Tuscon language?,The question is not answerable because all the languages mentioned in the context are related to the Italian Tuscan language in some way.
Why does Windows RT only work with apps excluded with the system?,"Windows RT only works with apps included with the system, supplied through Windows Update, or Windows Store apps because it is designed to run applications that are optimized for the ARM architecture. It does not support running IA-32 or x64 applications. This limitation is in place to ensure compatibility and performance on devices with ARM processors."
"Under the Parliament Acts of 1917 and 1949, the House of Commons may do what?","Under the Parliament Acts of 1917 and 1949, the House of Commons may direct that a bill be presented for royal assent despite lack of passage by the House of Lords."
 Which year was used for estimates in the 2004 report?,The question is not answerable based on the provided context as it does not mention any specific year used for estimates in the 2004 report.
Through what process is it thought that the first architectural achievements were not made?,"It is thought that the first architectural achievements were not made through a formalized or planned process, but rather through a process of trial and error, with a focus on replicating successful designs. This process likely involved experimentation with different materials, techniques, and forms, leading to the development of architectural styles that were gradually refined and improved over time."
What are parts of the Upper Moravia sometimes considered?,"The parts of Upper Moravia are sometimes considered as part of Rusyns, transitional between Ukrainians and Belarusians, Czechs, Moravians, and Poles. Additionally, there are sources that show Silesians as part of the Poles, with parts of the southmost population of Upper Silesia sometimes considered Czech, although this is controversial."
How many corps did the Byzantines have?,"The question is not directly answerable as it does not specify which specific corps within the Byzantine army are being referred to. The context provided discusses the organization of the Umayyad army and its reforms based on the Byzantine system, but it does not mention the exact number of corps within the Byzantine army."
Which European chef is The 1845 Room named after?,The 1845 Room is not named after a European chef.
How did James define reality?,"James defined reality as the sum total of all that is real, which includes both the physical world and the mental world. He believed that reality is constantly changing and evolving, and that our perceptions and experiences shape our understanding of what is real. James also emphasized the importance of pragmatism, which focuses on the practical consequences of beliefs and ideas in determining their truth."
What was transported along the rovers and canals of northern Mesopotamia?,"The question is asking about what was transported along the rovers and canals of northern Mesopotamia, but the context provided only mentions the volume of trade goods transported along the canals and rivers of southern Mesopotamia during the Uruk period. Therefore, it is not possible to accurately answer the question as it pertains to northern Mesopotamia."
Underwood dynasty was old Persian the official language?,"No, Underwood dynasty is not a historical dynasty or term related to the Persian language. The official language under the Sasanian dynasty in Iran was Middle Persian (Pahlavi)."
The least common standard test configuration procedure is what?,"The question is not answerable as it asks for the least common standard test configuration procedure, but only mentions the most common one, which is the JTAG standard. Without information on other standard test configuration procedures used in boundary scan testing, it is not possible to determine the least common one."
 When did Oregon reject the death penalty?,Oregon rejected the death penalty in 1964 through a public referendum.
What group speaks a number of Western Iranian languages?,"The Pamiri people speak a number of Eastern Iranian languages, not Western Iranian languages. Therefore, the question is not answerable in the context provided."
What has only a 1x write speed?,"The question is not answerable with respect to the provided context because it states that the original ReWritable CD could only be written at a minimum speed of 4x. Therefore, there is no CD mentioned in the context that has only a 1x write speed."
What section of What's New can show links to websites?,"The section of ""What's New"" that can show links to websites is the ""latest information"" section."
What accounts for nearly all the remaining graffiti consumption?,The question is not answerable with the provided context as it does not specify what type of graffiti consumption is being referred to.
What can predict its own future states of knowledge? ,"According to Popper's argument, no society can predict its own future states of knowledge scientifically. Therefore, based on the context provided, it is not possible for anything to predict its own future states of knowledge."
What aren't contracts?,"Contracts, in the context of Windows 8 applications, are a collection of hooks that provide common functionality for apps to integrate with other apps, including search and sharing."
When did Judah first become an independent kingdom?,Judah first became an independent kingdom around the 10th century BCE during the period of the United Monarchy.
What does having more protein coding genes not mean?,"Having more protein coding genes does not necessarily mean that the proportion of non-repetitive DNA will increase. In fact, as mentioned in the context, the proportion of non-repetitive DNA tends to decrease along with increasing genome size in higher eukaryotes. Therefore, the number of protein coding genes does not directly correlate with the amount of non-repetitive DNA in a genome."
What invaders are causing invasive plants in the Great Lakes region?,"The question of what invaders are causing invasive plants in the Great Lakes region is not directly answerable based on the provided context. The text discusses the general increase in species invasions, the impact of invasive species on native habitats, and the role of human activities in facilitating the spread of invasive species. It does not specifically mention which invaders are causing invasive plants in the Great Lakes region."
"On the day of the event, the President of the Senate reads to whom?","On the day of the event, the President of the Senate reads to the chamber the notice from the secretary to the governor general indicating when the viceroy or a deputy thereof will arrive."
What happened in 1899?,"In 1899, Charles Pollak continued his work on electrolytic capacitors, further developing his invention of the first electrolytic capacitors with aluminum electrodes."
How do you say Hebrew in French?,"In French, the word for Hebrew is ""hébreu."""
What riffs were combined to create swing?,"The question is not answerable as it is asking about the riffs combined to create swing, but the context provided is about the evolution and characteristics of heavy metal music, which does not involve swing elements."
How many drugs were approved in 2012?,"The question of how many drugs were approved in 2012 is not answerable based on the provided context. The information provided only includes approval numbers up until 2010, and there is no specific data given for drug approvals in 2012."
"Before World War II, what regions remain part of Ukraine?","Before World War II, the regions of Northern Bukovina, Southern Bessarabia, and Hertza remained part of Ukraine."
Why did the ECC reject systems such as MUSE?,"The ECC rejected systems such as MUSE due to their higher bandwidth requirements, which were not suitable for the growing number of television channels and the existing bandwidth limitations."
How many Slavs lived in Czechoslovakia?,"The question is not answerable as it does not specify a specific time period. However, based on the context provided, it can be inferred that a significant number of Slavs lived in Czechoslovakia after it was established in 1918."
What are some of the consequences of earning a Show Up?,"The consequences of earning a Show Up would likely be positive, as it is a recognition of good work or behavior. It may lead to rewards, praise, or other forms of positive reinforcement."
Where did most of the pilgrims come from?,"The question is not directly answerable based on the provided context. The context mentions pilgrimages to Virgil's tomb in the Middle Ages, but it does not specify where most of the pilgrims came from."
When was the Cooperative Baptist Fellowship destroyed?,The Cooperative Baptist Fellowship was not destroyed. It was formed in 1991 as a result of disagreements within the Southern Baptist Convention.
What's been released in North America with Japanese subtitles?,"Digimon Story: Cyber Sleuth has been released in North America with English subtitles, not Japanese subtitles. Therefore, the question is not answerable as there is no information provided about any other releases in North America with Japanese subtitles."
When was Jesus presented in a temple?,"The question of when Jesus was presented in a temple is not directly answerable based on the provided context. The focus of the text is on the purification of Jesus and Mary, as well as the theological implications surrounding their sinless natures. The presentation of Jesus in the temple is not specifically addressed in the text."
What coast did Hernando de Soto not find?,Hernando de Soto did not find the west coast of Florida.
As of when did Christianity have about 2.4 million adherents?,"The question is not answerable as it is stated incorrectly. As of the early 21st century, Christianity had approximately 2.4 billion adherents, not 2.4 million."
What is another name for the data being possessed? ,"Another name for the data being possessed in this context could be ""message packets."""
What animal was added in 2008?,The question is not answerable based on the provided context as it does not specify which animal was added in 2008.
What is happening to Orthodox Jewish communities because of intermarriage?,"The question is not answerable with respect to the provided context because intermarriage is not a significant issue within Orthodox Jewish communities, as the intermarriage rate is practically non-existent among Orthodox Jews."
In what year was Dorney Lake built?,Dorney Lake was built in 2006.
What document was written by Edward I in 1297?,The document written by Edward I in 1297 is the 1297 Magna Carta.
How long is Wilshire Blvd.?,"Wilshire Blvd. is not mentioned in the provided context, so it is not possible to determine the length of Wilshire Blvd. based on the information given."
The Protestant Reformation isn't attributed to what two developments that resulted from the invention of printing?,The Protestant Reformation is attributed to the influx of classical ideas and the democratization of learning that resulted from the invention of printing.
What was the worth Greece's shipping services lost in 2011?,"The worth of Greece's shipping services lost in 2011 cannot be determined based on the provided context. The information given only includes the value of shipping services exported and imported by Greece, as well as the trade surplus in the shipping sector. There is no specific mention of the worth of lost shipping services."
What began to happen to universities in the 1500's?,"In the 1500's, universities in Europe began to see a significant increase in numbers, with many new universities being founded. This growth continued throughout the Early Modern period, leading to a substantial expansion of higher education institutions across the continent."
What color did some women in Jerusalem like to wear?,The question of what color some women in Jerusalem liked to wear is not answerable based on the provided context. The passage from Luke's gospel does not mention anything about the color of clothing worn by the women in Jerusalem.
The Northern Ireland Executive and what other entity meet as the East/West Ministerial Council?,"The Northern Ireland Executive meets with the Government of Ireland as the North/South Ministerial Council, not the East/West Ministerial Council. The East/West Ministerial Council is made up of representatives from the Northern Ireland Executive and the UK Government."
In what year did Gough Whitlam become prime minister of Australia?,Gough Whitlam became Prime Minister of Australia in 1972.
When did Elliott Management's financing deal expire?,Elliott Management's financing deal with Universal expired in 2013.
The second largest deal in recorded music history was worth how much?,"The question is not answerable with respect to the provided context because the context only mentions the largest deal in recorded music history, not the second largest deal."
When are other medical conditions address?,Other medical conditions should be addressed as soon as possible after discharge from the hospital to ensure optimal management and participation in cardiac rehabilitation.
What policy did the company cancel after 2007?,The question is not answerable as it does not specify which company is being referred to.
How many students attend the Bath Teacher Training School?,The question is not answerable as the number of students attending the Bath Teacher Training School is not provided in the context.
What website was created in 2009 that was developed by the public?,The question is not answerable as there is no specific mention of a website created in 2009 that was developed by the public in the provided context.
What is the secondary theme of the Centre Room?,"The secondary theme of the Centre Room is a Chinese theme, as Queen Mary and Sir Charles Allom worked together to create a more ""binding"" Chinese theme in the late 1920s."
How much was stolen by overseas arms contractors?,The question is answerable. At least £3.5m was stolen by overseas arms contractors through corrupt payments to Gordon Foxley.
Who now organizes the Eton Choral Courses?,"Ralph Allwood is the one who set up and organized the Eton Choral Courses, which run at the School every summer."
How long were the Egyptians enslaved?,"The question of how long the Egyptians enslaved the Israelites is not directly answerable as there is no definitive historical evidence to determine the exact duration of the enslavement. The Hebrew Bible narrative provides a timeline from the arrival of Jacob and his family in Egypt to the Exodus led by Moses, but the specific length of time the Israelites were enslaved is not specified. Additionally, historical records outside of religious texts may not provide a clear answer to this question."
 Who sold one of the collections of mandolin magazines?,Morishige Takei sold one of the collections of mandolin magazines.
What Protestant group is fine with the mixing of religions?,"Based on the context provided, it is clear that Jehovah's Witnesses do not support the mixing of religions and are not fine with it. Therefore, the question of which Protestant group is fine with the mixing of religions is not answerable within this context."
What is the purpose of the rejected apparatus?,"The purpose of the rejected apparatus is to provide a record of rejected variants of the text, often in order of preference."
What do the judges choose?,"The judges choose how to score the gymnast's performance based on factors such as execution, difficulty, form, and landing."
Which theology did Pashupatas prefer?,"The Pashupatas preferred Pashupata theology, which emphasizes the independence of the soul and liberation from dependence on external factors. They disapproved of Vaishnava theology due to its doctrine of servitude to the Supreme Being."
What networks refused to share live coverage with each other?,STV refused to show FA Cup matches from 2008–09 to 2013–14.
What can impact memory performance in a negative way?,"Factors that can impact memory performance in a negative way include stress, learning in an unfamiliar context, and lack of cues that were present during the initial learning process."
In 1807 The Acts of Union ensured the Presbyterian church government in which country?,The Acts of Union in 1807 ensured the Presbyterian church government in Scotland.
The civil war lasted from 1982 to what year?,The civil war in Tajikistan lasted from 1992 to 1997.
"What is ""a yellow house"" in Finnish? ","The question is not answerable as it is asking for the translation of ""a yellow house"" in Finnish, but the context provided only discusses the declension of nouns and adjectives in Estonian."
What did the h become phonetically?,"The question is not answerable as it is asking about the phonetic evolution of the letter ""h"" in the Russian alphabet, which is not mentioned in the provided context."
"Whose decision was it that members of the Governing Body have ""deep truths"" imparted to them by the holy spirit?","The decision that members of the Governing Body have ""deep truths"" imparted to them by the holy spirit is believed to be made by the Governing Body itself, based on their understanding of the guidance they receive from the holy spirit. This belief is central to the teachings of Jehovah's Witnesses."
When was the iMac G6 released?,The iMac G6 was never released.
"How many SSNB ""Boomer"" squadrons were homeported at the Weapons Station?","The question is not answerable as it does not provide specific information regarding the number of SSNB ""Boomer"" squadrons homeported at the Weapons Station."
Shell's early history involved a lot of involvement from what?,Shell's early history involved a lot of involvement from the Shell Oil Company business in the United States.
When do routines begin?,"The question ""When do routines begin?"" is not answerable based on the provided context. The context only discusses the elements and skills involved in a pommel horse exercise, but does not mention anything about when routines begin."
How many representatives are on the Senate of the legislative branch in Berlin?,"The question is not answerable as it asks for the number of representatives on the Senate of the legislative branch in Berlin, but the context provided states that the Senate in Berlin consists of approximately eight members selected by the state's parliament."
What are students known as at Eton?,"Students at Eton are known as ""divs"" or ""divisions"" during classes."
When did Thuringia lose status as a landgraviate?,"Thuringia lost its status as a landgraviate after the War of the Thuringian Succession (1247–1264) when the western half became independent under the name of ""Hesse"" and the remaining Thuringia came under the rule of the Wettin dynasty of the Margraviate of Meissen."
What dropped world wide at the begining of the Devonian?,"At the beginning of the Devonian period, there was a global drop in sea level."
What is evoked by the faster C deltas?,"The question is not answerable as it is asking about what is evoked by the faster C deltas, but the context provided only discusses the differences between A-delta and C fibers in terms of pain signal transmission speed and the types of pain they carry. It does not specifically mention what is evoked by the faster C deltas."
The term asphalt is often preferred by who?,Geologists often prefer the term bitumen.
Jim Meyer considers what term to be useful in explaining scientific literature?,"Jim Meyer considers the term ""poeticity"" to be useful in explaining scientific literature."
What publication is Schodt not responsible for?,The question is not answerable as it is not specified which publication Schodt is responsible for.
What have predetermined policy preferences shown about charter schools?,"Predetermined policy preferences, such as those supported by the Gates Foundation, have shown mixed results when it comes to charter schools. While some studies indicate that charter schools have not improved educational outcomes and may have caused harm, it is important to consider the various perspectives and research findings on this topic."
 On what date was the 2008 Human Development Report released?,The question is not answerable based on the provided context as it does not mention the specific date on which the 2008 Human Development Report was released.
In what domain did electric motors not reduce reliance on humans and animals?,The question is not answerable as the context provided does not specify any domain where electric motors did not reduce reliance on humans and animals.
 What did Southwestern sell to raise funds for it's first building?,"Northwestern sold $100 ""perpetual scholarships"" to raise funds for its first building, Old College."
Which book has the Heidelberg Catechism adopted?,The Heidelberg Catechism has been adopted by the Presbyterian Church (U.S.A.) as part of the Book of Confessions.
How many national public service broadcasters does Somalia have?,The question is not answerable as the context only mentions the existence of Somali National Television (SNTV) as the principal national public service broadcaster in Somalia. It does not provide information on any other national public service broadcasters in the country.
How do scientists know that Native Americans have only the genetic markers they have identified?,"Scientists do not know for sure that Native Americans have only the genetic markers they have identified because not all Native Americans have been tested, and genetic testing cannot yet distinguish among members of differing cultural Native American nations. Additionally, there is genetic evidence for three major migrations into North America, but not for more recent historic differentiation."
"During the 2011–12 season, which two teams finished inside the top four for the first time since 1994-95?","During the 2011-12 season, the two teams that finished inside the top four for the first time since 1994-95 were Tottenham Hotspur and Manchester City."
What dance form is taught at the University of Hawaii?,Hip hop dance is taught at the University of Hawaii.
What did the code listing destandardize?,"The question is not answerable because it does not provide specific information about what the code listing destandardized. The context only mentions the standardization of write-in responses for the U.S. Census, but does not mention anything about destandardization."
What type of medium is not typically provided for a specific agent in a microbial culture?,The question is not answerable as it is too broad and does not specify a particular agent or type of medium.
When was the word Rajpoot first used?,"The word ""Rajpoot"" was first used in the translation of Ferishta's history of early Islamic India by John Briggs, but the exact date of its first usage is not specified in the provided context."
What form of government did the Greeks think was second only to democracy?,"The Greeks believed that an aristocracy, rule by the best men, was second only to democracy."
Where has cross-border policing been least under-studied?,"The question of where cross-border policing has been least under-studied is not directly answerable based on the provided context. The information given focuses on the challenges and issues related to cross-border policing, particularly in Europe and North America. It does not provide specific data or analysis on which regions or countries have been least studied in terms of cross-border policing. Therefore, it is not possible to determine where cross-border policing has been least under-studied from the information provided."
