question,answer
What have been introduced with a 617 nm diode-pumped solid state?,"With a 617 nm diode-pumped solid state, it is not specified what exactly has been introduced. The context only mentions the introduction of 671 nm diode-pumped solid state lasers for various applications, but does not provide information on any specific advancements or features introduced with a 617 nm diode-pumped solid state. Therefore, it is not possible to answer the question accurately based on the provided context."
How much pure oxygen is in the atmosphere?,"The question is not answerable as it asks for the specific amount of pure oxygen in the atmosphere, but the context provided does not give a direct answer to this question. The context discusses the importance of oxygen levels at different altitudes and in spacesuits, but does not provide a specific measurement of the amount of pure oxygen in the atmosphere."
Who did Endicott create a program to train and hire in 1942?,Endicott created a program to train and hire disabled people in 1942.
What type of radiation was Planck studying in the late 18th century?,"The question is not answerable as Max Planck was studying black-body radiation in the late 19th century, not the 18th century."
What three groups are annelids traditionally divided among?,"The question is not answerable as it asks for three groups that annelids are traditionally divided among, but traditionally annelids are divided into two major groups - polychaetes and clitellates."
What country makes up 83% of Africa's Christians?,Swaziland
What did Scottish Immigrants to Columba found in the 19th century?,"Scottish immigrants to England in the 19th century founded new Presbyterian Churches, including Crown Court, St Andrew's, and Swallow Street in London. Some of these congregations did not join the Presbyterian Church of England and remained affiliated with the Church of Scotland."
What are donors required to spend in Canada?,Donors in Canada are not required to spend a specific amount. It is the charities that are required to spend a certain percentage of their assets in order to maintain their charitable status.
When did Shell place informants in the Nigerian government?,"Shell placed informants in the Nigerian government in an undisclosed timeframe, as the specific date or period when this occurred is not provided in the context."
When did Risorgimento become the official language of the new Italian state?,Standard Italian became the official language of the new Italian state during the Italian Unification in the 1860s.
Why are Mizrahim sometimes termed Sephardi in historical usage?,"The term ""Sephardi"" is sometimes used to refer to Mizrahim in historical usage due to similar styles of liturgy, despite the fact that Mizrahim have independently developed from Sephardim proper. However, it is important to note that the divisions between these groups are not always clear, and the boundaries are approximate. The Mizrahim are a diverse collection of Jewish communities from North Africa, Central Asia, the Caucasus, and the Middle East, with no closer relation to each other than to other Jewish groups. Therefore, the term ""Sephardi"" in this context may not accurately reflect the distinct identities and histories of the Mizrahi communities."
What year did the Communists stop a riot from occurring?,The question is not answerable as it does not provide a specific year in which the Communists stopped a riot from occurring.
What does Shell sell 3.1 million barrels of per day?,Shell sells 3.1 million barrels of oil equivalent per day.
What is the simple name given to the dark quantum today?,The simple name given to the dark quantum today is not provided in the context.
Who controlled San Diego's charter for 4 years after it was revoked by California legislature?,"The city of San Diego was controlled by a board of trustees for 39 years after its charter was revoked by the California legislature, not 4 years."
What was the first commercial uses of non-LEDs?,"The question is not answerable as it asks about the first commercial uses of non-LEDs, while the context provided specifically discusses the development and commercialization of LEDs."
In what year did A.J. Ayer become a Professor of Logic at Oxford's Wykeham?,The question is not answerable as it does not provide any information regarding the specific year when A.J. Ayer became a Professor of Logic at Oxford's Wykeham.
what education does the national government subsidize?,"The national government subsidizes education in various fields such as primary and secondary education, vocational education, and higher education. However, based on the context provided, it is not clear if the national government specifically subsidizes education related to the cultural initiatives and amateur arts programs in Utrecht city. Therefore, it is not possible to determine the exact education that the national government subsidizes in this specific context."
"While Supreme Court holds these powers, who does it delegate them to?","The question is not entirely answerable as it is stated. The Supreme Court holds certain powers, but it is not explicitly stated in the context who these powers are delegated to. It is mentioned that Congress holds these powers and can delegate them to the Supreme Court, but it is not specified if the Supreme Court delegates these powers to anyone else."
 What type of license is very different from the ijazat al-tadris?,The question is answerable. An example of a type of license that is very different from the ijazat al-tadris is the licentia docendi in the European university system.
What can be seen as written logs?,"Written logs can be seen in the form of literature, whether factual or fictional, as they provide a record of societal norms, historical moments, cultural practices, and various academic fields."
Who's map is still preserved from the 2nd century A.D,Marinus of Tyre's unpreserved world map from the 2nd century A.D. is reportedly the map that is still preserved from that time period.
In what year did World War I end?,World War I ended in 1918.
Where did no marriages take place between European men and Native women?,No marriages took place between European men and Native women in all European colonies.
What is it called when a higher ranked team beats a lower ranked team?,"When a higher ranked team beats a lower ranked team, it is commonly referred to as an ""upset"" or a ""giant-killing."""
Over one-third of the student body has some proficiency in what?,Over one-third of the student body has some proficiency in a second language.
 In what part of the capacitor did Becker believe the charge was not being stored?,Becker believed that the charge was not being stored in the carbon pores of the capacitor.
When did the United States surpass Israel in Jewish population?,"The question of when the United States surpassed Israel in Jewish population is not definitively answerable at this time. Demographers disagree on whether Israel surpassed the United States in Jewish population during the 2000s, while others maintain that the United States still has the largest Jewish population in the world. A major national Jewish population survey is planned to ascertain whether or not Israel has overtaken the United States in Jewish population."
When a plane lands what does it do before returning to Tower Control?,"After a plane lands, it will be returned to Ground Control, not Tower Control."
What branch creates the Chevron doctrine?,"The Chevron doctrine was created by the judicial branch, specifically by the United States Supreme Court in the case Chevron U.S.A., Inc. v. Natural Resources Defense Council, Inc. in 1984."
When did Washington University become part of the University Athletic Association?,The question is not answerable based on the provided context.
Where was Lissouba's compound located?,Lissouba's compound was located in Brazzaville.
What book did John Gleck write about Feynman?,"The book that John Gleick wrote about Feynman is ""Genius: The Life and Science of Richard Feynman."""
What is more stable than the melatonin offset?,The question is not answerable as it is comparing the stability of the melatonin offset to something else that is not specified in the context provided.
Which terms are always mutually exclusive?,"The terms ""language"" and ""dialect"" are not always mutually exclusive, as demonstrated by the example provided in the context. Therefore, it is not possible to definitively state which terms are always mutually exclusive without further clarification or context."
It was the last year of Tribeca featuring a showcase of producers who do what?,The question is not answerable based on the provided context.
In what year was the Compagnie des Transport Strasbourgeois established?,The Compagnie des Transports Strasbourgeois (CTS) was established in 1994.
What philosophy does ontology concern?,"Ontology concerns the nature of being and existence. In the context provided, ontology is concerned with the existence and nature of space and time."
How many academic journal subscriptions does the Brown School Library have for family therapy?,"The Brown School Library maintains subscriptions to over 450 academic journals, but it is not specified how many of those subscriptions are specifically for family therapy. Therefore, it is not possible to provide an exact number of academic journal subscriptions for family therapy without further information."
What the spandex not soak up?,"Spandex is designed to soak up sweat, making it a popular choice for active sports and physical activities."
Charles Moreau was a chief architect of what you hungry?,"The question is not answerable as it does not make sense in the context provided. Charles Moreau was a French architect known for his work in Hungary, but there is no indication in the context that he was involved in any food-related activities."
Which branch of the UN created Rwanda in November 1995?,"The International Criminal Tribunal for Rwanda (ICTR) was created by the United Nations Security Council on 8 November 1994, not in November 1995."
What term is used to describe the mid-late Neolithic era in Asian education?,"The term used to describe the mid-late Neolithic era in Asian education is not provided in the context. Therefore, it is not answerable based on the information given."
When did Klagenfurt University lose its copyrights from the estate?,October 2008
How did William of Orange hope to unite Holland and Zeeland?,"William of Orange hoped to unite Holland and Zeeland by granting them the right to accept only one religion, which in practice was Calvinism. He believed in public and personal freedom of religion and hoped to unite Protestants and Catholics in the new union. However, in practice, Catholic services were quickly forbidden in all provinces, and the Reformed Church became the ""public"" or ""privileged"" church in the Republic."
What country has the largest Ukrainian population?,"The question is not directly answerable based on the provided context. While Kazakhstan has the largest Slavic minority population, it does not specify which country has the largest Ukrainian population specifically."
In what year was the Order of the Garter destroyed?,The Order of the Garter has not been destroyed.
What is material with a boiling point over 200 degrees Celsius considered?,Material with a boiling point over 200 degrees Celsius is considered a heavy fraction in the context provided.
How far downstream from Strasbourg does the River Rhine and River ILL meet?,"The River Rhine and River Ill meet downstream from Strasbourg, but the exact distance is not specified in the provided context."
"During this time, how aren't digital versions of the movie transported in data storage devices?","The question is not answerable because it assumes that digital versions of movies are always transported in data storage devices, which is not the case during the theatrical window. As mentioned in the context, digital versions of films are often transported in data storage devices by couriers rather than by data transmission to prevent piracy."
What is the approach of republicanism as developed by Mahbub ul Haq and Amartya Sen?,"The approach of republicanism as developed by Mahbub ul Haq and Amartya Sen focuses on the concept of ""liberty as non-domination"" and the capability approach, which emphasizes the real-world ability to act. They both view freedom as more than just the absence of interference, but also as the absence of domination and the presence of real options for individuals to make choices."
How many African Americans migrated to Liberia in 1867?,"It is not possible to determine the exact number of African Americans who migrated to Liberia in 1867 based on the information provided. The context mentions that by 1867, more than 13,000 African Americans had been assisted in migrating to Liberia, but it does not specify the exact number for that particular year."
What central idea do Yoga and Advaita Vendata share?,The central idea that Yoga and Advaita Vedanta share is the belief that liberation or moksha is achievable in this life through the understanding and realization of the equivalence of Atman and Brahman.
What is still the only element used to produce zinc?,Calamine is still the only element used to produce zinc.
Who was one of the Board of Trustees members in 1854?,"One of the Board of Trustees members in 1854 was not specifically mentioned in the provided context. Therefore, it is not possible to determine who exactly was a member of the Board of Trustees in 1854 based on the information given."
What was Charleston's population in 2012?,The question is not answerable with the provided context as it does not specify the population of Charleston in 2012.
What were the only two movies distributed internationally?,The only two Digimon movies that were distributed internationally are Digimon: The Movie and Ultimate Power! Activate Burst Mode.
What is the population of Cameroon as of 2014?,"The population of Cameroon as of 2014 is not provided in the context. Therefore, it is not possible to answer the question accurately based on the information given."
What did some plant parts do when the flower had only male parts?,"The question is not answerable as it is asking about the specific actions of some plant parts when the flower had only male parts. The context provided discusses the evolution of flowers and their structure, but does not provide information on the specific actions of plant parts in this scenario."
Who expanded on Avicenna's work in permanent logic?,Najm al-Dīn al-Qazwīnī al-Kātibī expanded on Avicenna's work in permanent logic.
Which idea is the controversy of non-affirmative action primarily based upon?,The controversy of non-affirmative action is primarily based upon the idea of class-based affirmative action as an alternative to race-based affirmative action.
 How many people were usually in these student-dealer orchestras?,"The question is answerable. The context provides information about the size of mandolin orchestras, ranging from 4 to 50 musicians."
How much of Thuringia's territory is in agricultural ruin?,"The question of how much of Thuringia's territory is in agricultural ruin is not answerable based on the provided context. The information given focuses on the importance of agriculture in Thuringia, the types of crops grown, and the areas where agriculture is intensive. There is no mention of agricultural ruin or the extent to which it exists in Thuringia."
What term describes a mixture of atoms that include at least some metal?,The term that describes a mixture of atoms that include at least some metal is an alloy.
When did Xiamen become compulsory in schools?,Xiamen became compulsory in schools in 2010.
What is the average for the amount of parrots that are consumed in the U.S on Thanksgiving Day?,"The question is not answerable as it is asking for the average amount of parrots consumed on Thanksgiving Day in the U.S, but the context provided only discusses the consumption of turkeys on Thanksgiving Day. Parrots are not typically consumed as part of Thanksgiving meals in the U.S."
Which system is used by the Airbus A380 and military jets?,Integrity-178B is the system used by the Airbus A380 and military jets.
Who is the wealthiest person in the UK as of 2015?,"The question is not answerable as it is about the wealthiest person in the UK as of 2015, and the context provided only mentions Queen Elizabeth II's personal wealth, not the wealthiest person in the UK."
 For what application was Tesla's motor never used?,The question is not answerable as it does not specify which specific motor of Tesla is being referred to.
What is defined as any one behavior of all animals that affects the current or future behavior of another animal?,The behavior defined as any one behavior of all animals that affects the current or future behavior of another animal is known as animal communication.
Who did the US Congress ask to create an exemption?,"The US Congress asked proponents of a conservation plan on San Bruno Mountain, California to create an exemption."
What nationality started the Italo-Turkish war?,The nationality that started the Italo-Turkish war was Italian.
What type of proteins developed as a result of circadian rhythms?,"The question of what type of proteins developed as a result of circadian rhythms is not directly answerable based on the provided context. The evolution of circadian rhythms is complex and involves a variety of proteins, including redox proteins, that have co-evolved with circadian oscillators. The specific types of proteins that have developed as a result of circadian rhythms would require further research and investigation."
Who do US companies generally employ?,"US companies, particularly pharmaceutical companies, generally employ salespeople (drug reps) to market directly to physicians and other healthcare providers. They also employ lobbyists to influence politicians."
What was a local dry cleaner found to be the main source of in 1979?,"The main source of pollution in Endicott in 1979 was identified to be IBM, not a local dry cleaner."
What does Congress believe hampers an agency's ability to deal with situations?,Congress believes that the lack of detailed statutes and the need for technical expertise are factors that hamper an agency's ability to deal with situations.
Which three browsers promised to develop Metro-style versions of their browsers?,"Chrome and Firefox were the two browsers that promised to develop Metro-style versions of their browsers. The third browser is not mentioned in the provided context, so it is not possible to determine which other browser made such a promise."
What calm weather does Neptune have?,"Neptune does not have calm weather. The planet's weather is characterized by extremely dynamic storm systems and high-speed winds, making calm weather conditions unlikely."
What is a terminal also referred to as?,A terminal at an airbase is also referred to as a passenger terminal or military terminal.
What can e paired with adaptive data called arithmetic coding?,Arithmetic coding can be paired with adaptive data in order to create a more efficient and effective compression technique.
What percentage of Iraq's budget was invested to help fight a direct threat in 2003?,"The question is not answerable as it does not provide specific information on the percentage of Iraq's budget that was invested to help fight a direct threat in 2003. The context only mentions the percentage of the MoD's equipment programme budget allocated for the ""land environment"" during that time period."
In what month in 1974 did Harold Wilson become prime minister?,Harold Wilson became Prime Minister in March 1974.
In 1976 what religious group was founded?,"In 1976, the Word of God religious group was founded in Ann Arbor."
What was Freemasonry linked to scandal in France due to?,"The question is asking about a scandal in France, but the context provided is about a scandal in Italy involving the Propaganda Due lodge. Therefore, the question is not answerable as it is not relevant to the information provided."
What discovery was made northeast of the city of Hagkol?,"The discovery made northeast of the city of Hagkol was the body of a crucified man, identified as Yehohanan ben Hagkol, dated to the 1st century."
What state contributed the most troops to the Union Army?,The state that contributed the most troops to the Union Army during the American Civil War was New York.
 What were the titles of Delaunay's paintings in 1914?,The question is not answerable as the titles of Delaunay's paintings in 1914 are not specifically mentioned in the provided context.
When did Internet Archive chance its platform for California?,"The question is not answerable as it does not provide specific information about when Internet Archive changed its platform specifically for California. The context only mentions a migration to Sun Open Storage in 2009 and hosting a data center on Sun Microsystems' California campus, but it does not specify a specific date for when the platform change occurred for California."
What does beer contain that brewers desire in hops?,"Hops contain bitterness, floral, citrus, and herbal aromas and flavors, antibiotic effects, and acidity that brewers desire in beer."
Choosing to follow comic book tradition and tropes was called what?,"Choosing to follow comic book tradition and tropes was called a ""superheroes in the real world"" approach."
CEO Weiss Barry left RCA/Jive Label Group in what year?,CEO Weiss Barry left RCA/Jive Label Group in March 2011.
When did The Glasgow Looking Glass end?,The Glasgow Looking Glass ended in 1826.
Who was one of the members of the Missouri General Assembly in 1853?,One of the members of the Missouri General Assembly in 1853 who played a role in securing the university charter for Washington University was Crow.
How many items aren't in The Yale University Art Gallery?,This question is not answerable as it is impossible to determine the exact number of items that are not in The Yale University Art Gallery without specific information on all the items in existence.
What is the alcohol content in all beer?,"The alcohol content in all beer can vary widely, typically ranging from 4% to 6% alcohol by volume (abv). However, it may vary between 0.5% and 20%, with some breweries creating examples of 40% abv and above."
Who gave followers of Humanism the ability to think inside the box?,"The question is not answerable as it is based on a misconception. Humanism, particularly during the Renaissance, encouraged thinking outside the box and challenging traditional beliefs and structures. The idea of thinking ""inside the box"" goes against the core principles of Humanism, which emphasized critical thinking, individualism, and the pursuit of knowledge beyond established norms."
What social groups were formed during the Neolithic age of Norte?,"The question is not answerable with respect to the provided context as it specifically mentions the Neolithic age of Norte, which is not specified in the information provided."
 Who agreed upon the 11:9 aspect ratio?,The 16:9 aspect ratio was agreed upon at the first meeting of the IWP11/6 working party at the BBC's Research and Development establishment in Kingswood Warren.
What term was first used in the 16th century?,"The term ""prime minister"" was first used in the 16th century."
Who invented dams?,"The invention of dams cannot be attributed to a single individual as they have been used by various civilizations throughout history for different purposes. In the context provided, Muslim engineers in the Islamic world pioneered the use of dams as a source of water power for industrial mills and machines."
What is the method in which videos can average a color similar to?,"The question is not answerable as it is unclear what specific method is being referred to in terms of averaging colors in videos. There are various methods and algorithms used in video compression that can average colors, such as chroma subsampling, quantization, and color space transformations. Without more specific information, it is difficult to provide a precise answer."
What was the name of the war between the Ostogoths and The Western Roman Empire?,"The question is not answerable with respect to the provided context. The war mentioned in the context is between the Ostrogoths and the Eastern Roman Empire (Byzantine Empire), not the Western Roman Empire."
The CBC only offered radio broadcasting in its northern regions before the advent of what?,The question is answerable. The advent of microwave and satellite broadcasting allowed the CBC to expand its television broadcasting in its northern regions.
How many special forces troops were there from Denmark?,The question is not answerable as the specific number of special forces troops from Denmark is not provided in the context.
"Upon dealing with leakage current and parasitic effects in a realistic model of a capacitor, what sort of methods will never be applied?","Methods that involve assuming capacitance is a constant will never be applied when dealing with combined parasitic effects such as inherent inductance, resistance, or dielectric losses that exhibit non-uniform behavior at variable frequencies of operation."
What has significantly contributed to shaping the Dry McMurdo Valleys?,"The fungi, including both non-lichen-forming and lichen-forming species, have significantly contributed to shaping the Dry McMurdo Valleys."
Which countries refused to recognize the RSFSR?,"The question is answerable. The countries that refused to recognize the RSFSR in 1920 were primarily Western powers such as the United States, United Kingdom, France, and Japan."
