question,answer
What watt lamp can produce 17.3 lumens per watt?,"The question is not directly answerable as it does not specify the voltage of the lamp in question. The luminous efficacy of a lamp is dependent on the voltage it is designed for, as mentioned in the context provided. Without knowing the voltage, it is not possible to determine what watt lamp can produce 17.3 lumens per watt."
"Why did teletype have extra spaces for ""rubout""?","The Teletype had extra spaces for ""rubout"" in order to allow for characters to be ""rubbed out"" and replaced with new characters on paper tape."
What engines did Rolls-Royce plc. build?,Rolls-Royce plc. built aircraft engines.
What principle further elaborates on how fiction can change history?,"The Novikov self-consistency principle further elaborates on how fiction can change history by proposing that any changes made by a hypothetical future time traveler would already have happened in his or her past, resulting in the reality that the traveler moves from. This principle suggests that history is not an unchangeable constant, but rather that any alterations made are already accounted for within the timeline."
Who may opt for the order of cardinal priests after they have been deacons for 30 years?,"Cardinal deacons may opt for the order of cardinal priests after they have been deacons for 10 years, not 30 years."
What does FAB stand for?,FAB stands for Forward Operating Base.
What is one of five indigenous mammals of Bermuda?,One of the five indigenous mammals of Bermuda is the bat species Lasionycteris noctivagans.
In particle physics what should there be to preserve entropy?,"In particle physics, to preserve entropy, there should be a small counterbalancing time asymmetry to maintain CPT symmetry."
What was the name of the second South Indie company that ended up running parallel to the first?,The name of the second South Indie company that ended up running parallel to the first was the English Company Trading to the East Indies.
What was the busiest Amtrak train station in 2010?,"The question is not answerable with the provided context as it specifically asks for the busiest Amtrak train station in 2010, but the information provided is for the busiest Amtrak train stations in Florida in 2011. Therefore, it is not possible to determine the busiest Amtrak train station in 2010 based on the information given."
What causes introgression pollution?,"Introgression pollution is caused by uncontrolled hybridization, introgression, and genetic swamping, which can lead to the homogenization or replacement of local genomes due to the numerical and/or fitness advantage of an introduced species. This process can be especially detrimental to rare species that come into contact with more abundant ones, as the abundant species can interbreed with the rare species, swamping its gene pool."
What cities in the UK had major Warp scenes?,"The question is not answerable as it is asking about Warp scenes in the UK, but the context provided only mentions Warp Records as a record label that helped introduce American and Italian dance music to Britain. It does not specifically mention any cities in the UK where major Warp scenes were present."
Where did languages from overseas get some of their words from?,"Languages from overseas, including the Cork accent, may have gotten some of their words from languages encountered by Cork's inhabitants at home and abroad. This could include words originating from languages other than Irish that were encountered through interactions with people from different regions or through trade and cultural exchanges."
What had no delays?,"This question is not answerable as it is too vague and does not specify what is being referred to. Without more context or clarification, it is impossible to determine what had no delays."
How many words for green does Thai have?,Thai language does not have a specific word for green.
Which three countries was Victoria trying to improve relations between?,France and Britain
What was the ethnicity of the people executed in the second-smallest mass execution in US history?,The question is not answerable with respect to the provided context as it does not specify the details of the second-smallest mass execution in US history.
When was the Federal Republic of France created?,The Federal Republic of France was not created. France is a unitary state and not a federal republic like Germany.
Where is Stop TB Partnership working?,"Stop TB Partnership is working in various countries around the world, particularly in high burden countries where tuberculosis is prevalent."
After who philosophy was never the same again in France?,"The question is not answerable as it is asking about who influenced philosophy in France, but the context provided only discusses the influence of Voltaire on religion in France. The impact on philosophy is not explicitly mentioned in the context."
What are the primary goals of the foundation in Seattle?,"The primary goals of the foundation in Seattle, the Bill & Melinda Gates Foundation, are to enhance healthcare and reduce extreme poverty globally, and to expand educational opportunities and access to information technology in America."
What years were journeys similar to the King trip to Melvern Hills made?,"The question is answerable. Similar journeys to the King trip to Melvern Hills were made in 1832, 1833, 1834, and 1835."
What did Pope Pius II do to Velletri and Ostia in 1914?,"Pope Pius II did not do anything to Velletri and Ostia in 1914 as he was a pope who reigned from 1458 to 1464. The separation of Velletri and Ostia was actually decreed by Pope Pius X in 1914, not Pope Pius II."
How many symptoms do people with diabetes typically report?,"The question is not directly answerable based on the provided context as it focuses on symptoms of myocardial infarction (MI) in women, not specifically on symptoms reported by people with diabetes. Therefore, it is not possible to determine the exact number of symptoms typically reported by people with diabetes from the information provided."
What attitude of Princess Margaret did Marion Crawford wrote she had?,Marion Crawford wrote that Princess Margaret had an attitude of responsibility.
Where in Beijing did the Dalai Lama's government flee?,"The Dalai Lama's government fled to Dharamsala, India."
How long did Avicenna study Mathmatics ,"The question of how long Avicenna studied mathematics is not answerable based on the provided context. The passage only discusses his struggles and studies in philosophy, not mathematics."
Where did the Jews migrate to before the Babylonian conquest?,The Jews migrated to Babylonia before the Babylonian conquest.
What percentage did General Electric sell to Vivendi Universal?,General Electric sold 80% of Vivendi Universal Entertainment to Vivendi Universal.
What language did the Jews of Israel not use at that time?,"The question is not answerable as it is not specified which specific time period is being referred to. The context provided mentions Hebrew, Aramaic, and Greek as languages spoken by Jews at different points in history. Therefore, without a specific time frame, it is not possible to determine which language the Jews of Israel did not use at that time."
 What were the affected industries in terms of deregulation as a result of Executive Order 10925?,"The question is not answerable as it is asking about the affected industries in terms of deregulation, but Executive Order 10925 actually focused on promoting equal opportunity and preventing discrimination in employment, particularly within the Federal Government and on government contracts. The order did not specifically address deregulation of industries."
How many commissioners worked above Reynie?,The question is not answerable because the number of commissioners who worked above Reynie is not provided in the context.
What are time measurements part of?,Time measurements are part of the aspect of Czech verbs.
It when went to football clubs not play Friendly's?,"The question is not answerable as it is unclear and grammatically incorrect. It seems to be asking about a specific time when football clubs do not play friendly matches, but based on the context provided, football clubs typically do play friendly matches before the start of each season."
What does Safe Harbor protect?,"Safe Harbor protects unlisted species by providing incentives to private landowners and land managing agencies to restore, enhance, or maintain habitat for declining species that have the potential to become threatened or endangered. If the unlisted species becomes listed in the future, the landowner will not be required to do more than already agreed upon in the Candidate Conservation Agreement with Assurances (CCA)."
What is definitely seen as being read by Avicenna?,It is not definitively seen as being read by Avicenna that Liber Aboali Abincine de Anima in arte Alchemiae is a fake or not actually written by him. The authenticity of this work is still debated among scholars.
Who settles the dispute when the President and Vice President cannot come to an agreement for a date of adjournment?,"When the President and Vice President cannot come to an agreement for a date of adjournment, the President may settle the dispute according to the context provided."
What can be done to sugar to give it a certain look?,"To give sugar a certain look, it can be colored using food coloring or edible dusts. However, the question is not answerable in the context provided as it pertains to the patina of metal, specifically copper, and not sugar."
"Where isn't Magasin's ""flagship"" store located? ","The question is not answerable as it does not provide specific information about the location of Magasin's ""flagship"" store."
How long does basic artillery training last for?,"Basic artillery training is not specifically mentioned in the provided context. Therefore, it is not possible to determine the exact duration of basic artillery training without additional information."
Due to the new entry style what rooms were moved up one floor?,The main reception rooms were moved up to the ground floor due to the new entry style.
What damage amounted to $2 billion from 2016-2018?,The question is not answerable with respect to the provided context as it does not specify what type of damage is being referred to.
Who was the president of Hungary during the dissolution of the Warsaw Pact?,The president of Hungary during the dissolution of the Warsaw Pact was Árpád Göncz.
What was a top club for house music in Detroit?,"The question is not answerable as it specifically asks for a top club for house music in Detroit, but the context provided only mentions clubs in Chicago, Newark, and New York City. There is no mention of a specific club in Detroit for house music."
What does runway edge lighting indicate for landing?,Runway edge lighting indicates the edges of the runway to help pilots maintain proper alignment during landing.
What do not have throats?,"Annelids that move by means of cilia, whipping movements of the body, or by turning their pharynges inside out to burrow do not have throats."
Who is Brian L. Robert's son?,Brian L. Roberts' son is Tucker Roberts.
What happened when Malietoa Tanumafili II ran again in 2012?,Malietoa Tanumafili II did not run again in 2012 as he had passed away in 2007.
"What are Christians not expected to do, since they are iconodules?","Christians, as iconodules, are not expected to engage in the worship of icons or images as representations of God or the divine. Iconodules believe that the use of icons in worship can aid in connecting with the divine, but they do not worship the icons themselves."
What is Article 93 about?,"Article 93 is not mentioned in the provided context, so it is not possible to determine what it is about without further information."
 What is common in undeveloped countries?,"The question is not specific enough to provide a clear answer. Undeveloped countries can vary greatly in terms of their characteristics and challenges. It would be more appropriate to ask about specific aspects such as access to clean water, education, healthcare, infrastructure, or economic development in undeveloped countries."
What mundane property does the alloy made up of 90% copper and 10% nickel possess?,The mundane property that the alloy made up of 90% copper and 10% nickel possesses is its resistance to corrosion.
Where does the Harlequins Cricket Club want to introduce the sport to?,The question is not answerable as there is no specific information provided about where the Harlequins Cricket Club wants to introduce the sport to.
"The northern third of Ireland was inhabited by Picts, while the southern two thirds by who?",The southern two thirds of Ireland were inhabited by Britons.
"In addition to wool, what isn't uranium salt a mordant of?",Uranium salt is not a mordant of silk.
 Restdeutsche live in lands that where never part of what?,Restdeutsche live in lands that were never part of Germany.
"By 1972, Columbia Record Productions was operating how many plants?",The question is not answerable based on the provided context as it does not mention the specific number of plants operated by Columbia Record Productions by 1972.
"When you are an agnostic, what do you think doesn't exist?","As an agnostic, one may believe that the existence of God is unknown or unknowable. Agnosticism does not necessarily assert that God does not exist, but rather that the existence of God cannot be proven or disproven. Therefore, what an agnostic thinks doesn't exist would depend on the individual's personal beliefs and interpretations."
What kind of instruments are favored by Hylian?,"The instruments favored by Hylian are live instruments, specifically a full 50-person orchestra for action sequences and a string quartet for more ""lyrical moments"". However, in the final product, sequenced music was used instead due to the lack of interactivity that comes with orchestral music."
When did the second Indiana Jones movie come out?,"The second Indiana Jones movie, ""Indiana Jones and the Temple of Doom,"" came out in 1984."
What kind of properties does Coulomb's law have?,"Coulomb's law describes the electrostatic interaction between charged particles and states that the force between two charges is directly proportional to the product of the charges and inversely proportional to the square of the distance between them. However, in the context of QED vacuum, Coulomb's law is modified due to the presence of vacuum fluctuations and the finite energy of vacuum energy. Therefore, the properties of Coulomb's law in QED vacuum are different from those in a standard vacuum or classical electrostatics."
What percent lower was Dell buying its notebooks in Taiwan?,"The question is not answerable as the specific percentage by which Dell was buying its notebooks in Taiwan is not provided in the context. The information given only mentions the price at which Dell offered the Latitude E4300 notebook on its Taiwanese website, but it does not mention the actual cost or percentage lower at which Dell was purchasing the notebooks."
What was written in 1897?,"The question ""What was written in 1897?"" is too broad and lacks specific context to provide a meaningful answer. Without additional information or clarification, it is not possible to determine what exactly was written in 1897."
What isn't a tiered system? ,"A tiered system is a system that is structured in layers or levels, with each level having its own set of responsibilities and powers. In the context provided, the government of India is based on a tiered system with the Union Government, State governments, and Panchayats/Municipalities each having their own specific roles and powers. Therefore, what isn't a tiered system would be a system that does not have different levels or layers of government with distinct responsibilities and powers."
 In what order are words put in sentences in the Finnish language?,"The question is asking about the word order in the Finnish language, but the context provided is about the Estonian language. Therefore, the question is not answerable with respect to the context given."
Which interpretation of Avicenna's work was less taught in Islamic schools?,"The question is answerable. The theological interpretation of Avicenna's work championed by figures like al-Razi was less taught in Islamic schools compared to the other interpretations that focused on applying his philosophy to political events, scientific advances, or gaining spiritual insights through mystical means."
 What colony did Roger Williams escape from?,Roger Williams escaped from the Massachusetts Bay Colony.
What is Mata o le Afi probably the result of?,"Mata o le Afi is probably the result of volcanic eruptions in Samoa, specifically on the island of Savai'i."
What are Historical Orthodox more willing to assume about changing realities?,"Historical Orthodox are more willing to assume that under scrupulous examination, identical principles may lead to different applications in the context of modern life."
"What design style does Romanesque architecture in Germany, Poland, and Australia rarely follow?","The question is not answerable as it is asking about a design style that Romanesque architecture in Germany, Poland, and Australia rarely follow, but the context provided is about the characteristics of Gothic architecture in Central Europe. Romanesque and Gothic architecture are distinct styles, so it is not relevant to discuss what design style Romanesque architecture in those specific countries rarely follow based on the information provided."
What did Bradley say Moore did not understand?,Bradley said that Moore did not understand the statement that something is real.
"How many Norfolk Island residents lost their vote on May 8, 2015?","Based on the context provided, it is not clear how many Norfolk Island residents lost their vote on May 8, 2015. The focus of the information is on the referendum results and the implications for the proposed reforms, rather than the number of residents who may have lost their voting rights. Therefore, this question is not directly answerable with the given context."
When was the award given to President Johnson?,"The award, the Presidential Medal of Freedom, was given to President Johnson on 3 December 1963."
What literary genre exploded in thee early 18th century?,The literary genre that exploded in the early 18th century was Romanticism.
How selective are admissions at Southwestern characterized by U.S. News & World Report?,"The admissions at Southwestern, as characterized by U.S. News & World Report, are considered ""most selective."""
What effect didn't the discoveries of Columbus and da Gama have on European nations?,"The question is not answerable as it is asking for information on something that did not happen, which cannot be determined based on the context provided."
In what city is the Danforth Campus?,"The Danforth Campus is located in Clayton, Missouri."
Which kind of beer used mould in the process?,Mould was not used in the process of making beer in ancient times as mentioned in the context.
Where are dependent circadian rythems found?,"Dependent circadian rhythms are found in many organs and cells in the body outside the suprachiasmatic nuclei (SCN), the ""master clock"". These clocks, called peripheral oscillators, are found in the adrenal gland, oesophagus, lungs, liver, pancreas, spleen, thymus, and skin. Additionally, there is some evidence that the olfactory bulb and prostate may experience oscillations when cultured, suggesting that these structures may also be weak oscillators."
"With a week of its release, on what website did the PS3 Slim become the number-one bestseller?",The PS3 Slim became the number-one bestseller on Amazon.com within 24 hours of its announcement.
How many Houses are there?,"The question ""How many Houses are there?"" is not answerable based on the provided context. The passage describes the development and purpose of Houses at a school, but it does not specify the total number of Houses in this particular school."
What did Apple introduce to take the place of a physical scroll wheel in 2008?,Apple introduced the Magic Mouse in 2009 to take the place of a physical scroll wheel.
What theory did Matisse say his choice of colors was based on?,"Matisse said his choice of colors was not based on scientific theory, but rather on observation, feelings, and the real nature of each experience."
Alan Shearer became the fifth British player to do what?,Alan Shearer became the fifth British player to command a transfer fee of more than £15 million when he made a record-breaking move to Newcastle United in 1996.
Who was the failed architect of the Houses of Parliament?,The failed architect of the Houses of Parliament was Sir Charles Barry.
What style of park is the Parc du Heyritz?,"The style of park that the Parc du Heyritz is designed in is not explicitly mentioned in the provided context. Therefore, it is not possible to determine the specific style of the Parc du Heyritz based on the information given."
What percentage of voters rejected the status of a statehood?,"The question is not directly answerable as the percentage of voters who rejected the status of statehood is not explicitly provided in the context. The information given focuses on the percentage of voters who voted for statehood as the preferred alternative, abstained from answering, and the arguments made by statehood opponents regarding the inclusion of abstentions in the results."
What sound do users hear when uncovering weapons in the game?,"The sound users hear when uncovering weapons in the game is the series' trademark ""chime"" in the Wii version."
What example of Stoic influence followed Plato's?,"The question is not answerable as it is asking for an example of Stoic influence that followed Plato's influence, but the context provided does not specify a direct connection between a specific Stoic influence and Plato's influence."
How was coal shipped from the Somerset Coalfield?,"Coal from the Somerset Coalfield was likely shipped via railways or canals to nearby harbors for transportation to other locations. However, specific details on how coal was shipped from the Somerset Coalfield are not provided in the context, so it is not possible to give a definitive answer."
What was prohibited after the 1950s? ,Marriage between European and Asian Americans was prohibited until the 1950s.
What royal residence did George VI own?,George VI owned the royal residences of Balmoral Castle and Sandringham House.
After what time did anybody you could get away with using the title architect do so?,"The question is not answerable as it is unclear and ambiguous. The context provided discusses the adoption of the title ""architect"" by individuals who were not necessarily trained professionals. It does not specify a specific time frame after which this occurred."
From what country do most tourists to Namibia come from?,"The question is answerable. Most tourists to Namibia come from neighboring countries such as South Africa, followed by European countries like Germany and the United Kingdom."
What does the level of an achievement resulting from a pathogen depend on?,"The level of an achievement resulting from a pathogen depends on the interplay between the pathogen's ability to damage the host and the host's ability to resist the pathogen. Additionally, the host's immune system response can also play a role in determining the severity of the disease."
When did Ontario repeal the Canada Corporations Act?,"The question is not answerable as it does not specify the exact date when Ontario repealed the Canada Corporations Act. The context provided only mentions the adoption of the Ontario Not-for-Profit Corporations Act in 2010, with an expected effective date of 1 July 2013."
What rule predicts that emitted energy decreases with temperature?,"The question is not answerable as it is asking for a rule that predicts emitted energy decreases with temperature, but the context provided discusses how emitted energy actually increases with temperature according to the Stefan-Boltzmann law."
Who was expelled from the National Labour Organisation?,Ramsay MacDonald and his supporters were expelled from the National Labour Organisation.
When was the Conservative party 17 million in debt?,The Conservative party was £17 million in debt between January and March 2008.
"In 1923, what was discovered to be safer to treat encephelitis?","In 1923, it was discovered that a safer vaccine for diphtheria could be produced by treating diphtheria toxin with formaldehyde."
 Which program facilitates the exchange students across Asia?,The question is not answerable with the provided context as it does not specify a particular program that facilitates the exchange students across Asia.
Who is attributed as the only person to document zinc?,Paracelsus is attributed as the only person to document zinc in his book Liber Mineralium II in the 16th century.
What year was the Purification of the Blessed Virgin Mary?,The Purification of the Blessed Virgin Mary is celebrated on February 2nd.
What does animal migration reduce competition for?,Animal migration reduces competition for food and shelter among the migrating animals themselves.
Where can the Community Tool Box not be found?,"The Community Tool Box can be found online as a free resource provided by the University's Work Group for Community Health and Development. Therefore, it cannot be found in physical locations such as libraries or stores."
"What creates conversation called a ""frame""?","The creation of conversation segments called a ""frame"" is typically done by codecs to create discrete data segments for encoding and decoding."
